Crops,Original_Search_Title,Link,Headline,Date,Publisher,Publisher_URL,Source_URL,Body_Text
cassava,Epe Triumphs At Ultimate Golf Challenge in Ikoyi Club,https://allafrica.com/stories/202412270049.html,Nigeria: Epe Triumphs At Ultimate Golf Challenge in Ikoyi Club,25 December 2024,Daily Trust (Abuja),https://dailytrust.com/,https://dailytrust.com/epe-triumphs-at-ultimate-golf-challenge-in-ikoyi-club,"One of Nigeria's top golfers, Francis Epe delivered a masterful performance at the tree-lined fairways of Ikoyi Golf Course, clinching his second Ultimate Golf Challenge title.
The competition featured 39 top golf professionals drawn from the PGA of Nigeria's Order of Merit, USPGA, and neighboring countries.
Epe emerged victorious in the 36-hole tournament, finishing with a 6-under-par 136, two strokes ahead of Vincent Torgah, who mounted a spirited challenge.
Epe carded an impressive opening round of 3-under-par 68, followed by another 3-under-par 68 in the final round, showcasing consistency and skill on the course where he holds the record.
Torgah, the Ghanaian professional, made a strong push with a final-round 4-under-par 67 but fell short against Epe's steady play. Patrick Paul of Ikoyi Club claimed third place with a score of 1-over-par 143, while Gabriel Ejembi and Godwin Okoko also put in commendable performances.
Grand Patron of the Ultimate Golf Challenge, Femi Pedro, praised the players and organizing committee, reiterating the need to grow professional golf in Nigeria.
""This initiative was born out of the desire to elevate professional golf and support our players,"" he said. Pedro also expressed gratitude to sponsors Polaris Bank, Cassava Microfinance, GTI, Mactay, and GAC Motors.
Tournament Organizing Committee Chairman, Akin Semowo, highlighted plans to enhance the event further. ""The 36-hole one-day format sets us apart, and with the incredible support we've received, we're committed to making next year's tournament even better,"" he concluded.
Meanwhile, the Leader Joe 1808 Foundation recently hosted a junior golf tournament that brought together 150 children from across Nigeria. The event held in Abuja was aimed at celebrating sportsmanship while promoting access to quality education for all children.
Speaking at the tournament, Executive Director and Founder, Leader Joseph Onu, highlighted the dual purpose of the event: ""This is not just a golf tournament; it's a platform to promote the culture of going back to school. Every child deserves a quality education.""
Onu also noted that the foundation currently supports 119 children nationwide through its scholarship program. The foundation's initiative underscores its commitment to empowering young Nigerians through education and sports, creating pathways for a brighter future."
cassava,Epe Wins Ultimate Golf Challenge At Ikoyi Club,https://allafrica.com/stories/202412260054.html,Nigeria: Epe Wins Ultimate Golf Challenge At Ikoyi Club,23 December 2024,This Day (Lagos),http://www.thisdaylive.com/,https://www.thisdaylive.com/index.php/2024/12/23/epe-wins-ultimate-golf-challenge-at-ikoyi-club/,"Playing like someone infused with winning bug, Francis Epe tore through the tree-lined fairway of Ikoyi Golf Course on his way to claiming his second Ultimate Golf Challenge title.
The competition featured 39-selected top golf professionals drawn from the PGA of Nigeria's Order of Merit list, USPGA and others from neighbouring countries.
To come tops in the 36-hole competition, Epe grossed a score of 6-under par 136, wining by two shots over hard fighting Vincent Torgah.
He had shots an opening 3-under par 68, and a closing 3-under par 68 for 136-total to win the competition.
The second placed Ghanaian professional Torgah fought back in the second round with a resounding 4-under 67 but his efforts came to naught as Epe held his nerve, winning on the course on which he hold the course record.
Patrick Paul also from Ikoyi club finished third at 1-over par 143 over 36-hole. Gabriel Ejembi and Godwin Okoko were other top golfers who gave a good account of themselves.
Satisfied with the display by the golfers, Grand Patron of Ultimate Golf Challenge, Femi Pedro, while thanking the organising committee for job well done, said there was the need to grow professional golf in Nigeria and encourage the players' necessitated the setting up of Ultimate Golf Challenge, the team will continue to work for the progress of professional golf in Nigeria.
He commended Polaris Bank, Cassava Microfinance, GTI, Mactay and GAC Motors for their support.
Chairman, Organising Committee, Akin Semowo, said efforts would be made to make the tournament better.
""It's been awesome, especially with the support we've been getting. I am excited from what I have seen and I must say that the 36-hole we play in one-day is part of our plans to make the tournament unique"", Semowo concluded."
cassava,Les Mamans Du Congo - Saving the Past for the Future,https://allafrica.com/stories/202412040015.html,Congo-Kinshasa: Les Mamans Du Congo - Saving the Past for the Future,3 December 2024,Afropop Worldwide (New York),https://www.afropop.org/,https://afropop.org/articles/les-mamans-du-congo-saving-the-past-for-the-future,"One of the most interesting acts we saw perform at WOMEX this year was Les Mamans du Congo. The group marries the natural, the found and the electronic to create their unique sound. French producer Rrobin provides the electronic elements, while Gladys Samba and four other women sing, dance, and play percussion from recycled household goods, but also natural sounds, like sifting sand, or blowing through reeds into bowls of water. On hand, as well, was Gladys' husband, renowned Congolese jazz bassist Mel Malonga, who has worked with artists including Rido Bayonne, Ali Farka Touré, Lokua Kanza, Meiway and Damon Albarn, and serves as artistic director of the project.
Samba has said the impetus for this project was born first out of the desire to call attention to the imbalance of women's place in Congolese society, who are generally relegated to domestic duties and second-class status though, she explains, this was not always the case. Also, Samba decided to focus on traditional children's songs that are filled with life lessons that were quickly disappearing into history because young people weren't showing interest in preserving them. By bringing in hip, electronic beats, she hoped these songs would find a fresh and new life among the next generation. And, according to Samba, this mission has been a success.
Samba's own journey was fraught with life lessons as she fought her way to adulthood. As a young girl who lost both parents, she worked in the cassava fields of her village, but then went on to earn a secretarial degree and worked in Brazzaville. But when war broke out in 1997, she returned to her village. Throughout all this, music and art remained her passions - even though her brothers looked down on her. To them, to sing on a stage was akin to prostitution. She has said that often she would come home from concerts and the door was locked, so she had to sleep outdoors. That all changed when she started to earn a living doing it.
Samba is today an empowered symbol of what women in Congo can achieve. While starting this project, she was also teaching visual arts at a school, running a nonprofit that helps women start their own business, and managing her own restaurant.
We were able to sit down with Samba briefly after their sound check, along with Rrobin who served as interpreter, to discuss a bit of her journey. The following has been edited for both length and clarity.
Ron Deutsch: I've heard you speak about how one of the intentions of this project is to amplify and empower women's voices in the Congo. You are a very strong, vocal and outspoken woman. Why do you think it is that this has been easier for you to be this way, and yet ir remains hard for others at home?
Gladys Samba: It was easier for me because I lost my mother very early and life forced me to fight alone. And so I encountered a lot of problems in my life where I had to look for the solutions myself. But when you lose a mother very early - I was six years old and growing up with siblings - it's not the same affection you receive. So suddenly, it already gives you the desire to grow up quickly, the desire not to count on someone else, and to trace your own path. It was very difficult, very difficult. You cannot rely on somebody; you can't rely on anybody. You are called upon to fight, that's it. Really, that's what made me strong.
Yes, my father was there, but not all the time. He worked from morning to night. And then there are the other little ones.And so I was alone taking care of them. Now I already had older brothers in high school, and I was in school too, but there are taboo things in our culture. For example, an older brother cannot wash his little sister. On the other hand, a big sister can wash her little brother. I had older sisters, but they died during the events of the wars in the country. And so I stayed with my five older brothers and a little sister and little brothers. I was forced to learn to wash myself and the little ones.
I was lucky with my father, though, because he directed the women's choir at church. He was the one who played the role of mother and who taught me to sing lullabies. And he often spoke to me about our roots, where we come from as Congolese. So he was talking to me about that, saying to me, ""Listen, you mustn't forget your tradition. You mustn't forget where you come from, because you are a Mampinga. You are a warrior of Mampinga."" That's the luck I had. My father, he didn't give up on teaching me my culture, my language, and the music of our country. All that, the role, it's my father who did it. But then I lost my father as well. I was almost 16 years old then. And I had to be the mother now. So, he didn't really see me grow up. But I know he's proud of me where he is. He sees what I've done.
My understanding is that these songs carry stories that are, like, metaphors of larger issues, bigger things. They're not just children's songs, but they carry some message that one should have throughout one's life. Can give me an example of this kind of song?
For example, there is a song ""Perle Precieuse"" (""Precious Pearl""). In it, a child has lost his pearl and asks his parents and big brother, ""Where is the lost pearl?"" The answer they tell the child is that it's behind the house. But behind the house is the school, though the school is not mentioned in the song, but it's understood. And the child comes to understand that the pearl is, in fact, knowledge. And if you look for knowledge, you have go to the mbongi, which is not the day school, but is the meeting place for people of all generations. Because many children lost their parents and so it is in the mbongi they are educated and learn how to grow up, how to know everything that happens in society. They go in the morning and in the night - before and after school. So many people, when we sing the song there, take it literally, that it is about a real pearl. You go to find the pearl, but that's not it, that is the first level. But in the second level, we see it refers to all the education that is behind the house.
This is not just a musical project; it has a higher purpose. Can you talk about that a bit? And do you see the music making an impact in Brazzaville, even in just the city, or beyond. Are you recognized at home for what you are trying to do with this project?
The big purpose of the project is not just making music, the main purpose is to save matriarchal heritage and culture in the Congo. I realized all this culture, the songs, that the younger generation was about to lose it, because of modern culture. And mixing the ancestral tradition with electronic music allows the younger generation to re-appropriate it and this is having a big impact. Everyone knows me in my country.
This project is already a way to raise awareness among people about what is happening in Africa and about what is happening in the daily lives of African women. Also our music is about sharing, friendship, living together with people from the West, the South, the North, everyone. We are all the same. So the main message is diversity, and diversity colors the world, whether it is black, red, green, yellow, blue - well, blue does not exist - but everyone. Because we all have blood, and nature wanted it to be like that. And we can play, eat, work, and love together. It is a message of unity.
Any thoughts of running for president?
(Laughs) Many people would like to see a woman president, but it's not for me.
Thank you for your time and have a good showcase tonight.
Merci."
cassava,Barmaids At 15 - Mbarara's Struggle Against Adolescent Exploitation,https://allafrica.com/stories/202412030662.html,Uganda: Barmaids At 15 - Mbarara's Struggle Against Adolescent Exploitation,2 December 2024,Nile Post (Kampala),https://nilepost.co.ug/,https://nilepost.co.ug/health/230366/barmaids-at-15-mbararas-struggle-against-adolescent-exploitation,"Mbarara District is witnessing an alarming rise in adolescent girls working in bars, exposing them to abuse, exploitation, and significant health risks.
Despite the availability of skilling programs and income-generating initiatives, many young girls, some as young as 15, are turning to bar work due to poverty, family breakdowns, and societal challenges.
One such girl shared her harrowing journey, which began when she was orphaned and dropped out of school at 15.
After an abusive marriage, teenage pregnancy, and contracting HIV, she turned to bar work to support her child.
""I've been to bars in Hoima, Mbale, and now back here. Many times, I've worked without pay, but I keep going to survive,"" she recounted.
Community elder Innocent Mutabazi highlighted the allure of quick money as a key factor. ""We urge these girls to consider small businesses like selling cassava, but the money men offer in bars draws them back,"" he explained.
Dr Christopher Nahabwe, the district's HIV/AIDS focal person, warned of the dangers facing underage girls in bars.
""At 15, they lack the decision-making skills to navigate such environments. They are easily manipulated and often face physical and emotional harm,"" he stated.
The HIV prevalence among sex workers in Mbarara is 54%, compared to the national average of 33%, further illustrating the health risks these young girls face.
Challenges in Intervention
Joab Abaho, Mbarara District's Probation and Welfare Officer, acknowledged the severity of the problem but cited inadequate funding as a barrier to effective intervention.
""Programmes like the Youth Livelihood Programme and Young African Refugees for Integral Development (YARID) aim to help, but community-based services need more resources to create lasting impact,"" he explained.
Abaho emphasized the need to strengthen girl-child education and ensure their safety in school, on their way home, and within their communities.
""Education is the most sustainable way to reduce the numbers of girls turning to bars and manage prostitution,"" he said.
Local authorities are advocating for stricter enforcement against bar owners who exploit underage workers.
Proposals include requiring bar owners to maintain wage rolls and improve working conditions to protect young employees from unpaid labor and abuse.
As the district battles this growing challenge, a multi-faceted approach combining education, community awareness, stricter enforcement, and enhanced funding for youth programs is essential to protect vulnerable adolescents from exploitation and harm."
cassava;yam,"Inflation Rate Reverses Decline, Rise to 32.7%",https://allafrica.com/stories/202410150416.html,"Nigeria: Inflation Rate Reverses Decline, Rise to 32.7%",15 October 2024,Vanguard (Lagos),http://www.vanguardngr.com/,https://www.vanguardngr.com/2024/10/breaking-inflation-rate-reverses-decline-rise-to-32-7/,"Nigeria's inflation rate rose to 32.7 per cent in September, reversing two two-month consecutive decline to 32.15% in August.
The reversal was driven by a surge in the Month-on- Month Food Inflation to 2.64% from 2.37%.
The National Bureau of Statistics, NBS disclosed this in its Consumer Price Index, CPI Report for September.
The Bureau said: ""In September 2024, the Headline inflation rate was 32.70% relative to the August 2024 headline inflation rate of 32.15%. Looking at the movement, the September 2024 Headline inflation rate showed an increase of 0.55% compared to the August 2024 Headline inflation rate.
""On a year-on-year basis, the Headline inflation rate was 5.98% points higher compared to the rate recorded in September 2023 (26.72%).
""This shows that the Headline inflation rate (year-on-year basis) increased in September 2024 when compared to the same month in the preceding year (i.e., September 2023).
""Furthermore, on a month-on-month basis, the Headline inflation rate in September 2024 was 2.52%, which was 0.30% higher than the rate recorded in August 2024 (2.22%).
""This means that in September 2024, the rate of increase in the average price level is higher than the rate of increase in the average price level in August 2024.""
Food inflation
The NBS further said: ""The Food inflation rate in September 2024 was 37.77% on a year-on-year basis, 7.13% points higher than the rate recorded in September 2023 (30.64%).
"" The rise in Food inflation on a year-on-year basis was caused by increases in prices of the following items: Guinea Corn, Rice, Maize Grains, Beans, etc (Bread and Cereals Class), Yam, Water Yam, Cassava Tuber, etc (Potatoes, Yam & Other Tubers Class), Beer (Local and Foreign) (Tobacco Class), Lipton, Milo, Bournvita, etc (Coffee, Tea & Cocoa Class) and Vegetable Oil, Palm Oil, etc (Oil & Fats Class).
""On a month-on-month basis, the Food inflation rate in September 2024 was 2.64% which shows a 0.27% increase compared to the rate recorded in August 2024 (2.37%).
""The rise can be attributed to the rate of increase in the average prices of Beer (Local and Foreign) (Tobacco Class), Vegetable Oil, Groundnut Oil, Palm Oil, etc (Oil & Fats Class), Beef, Gizzard, Dried Beef, etc (Meat Class), Lipton, Milo, Bournvita, etc (Coffee, Tea & Cocoa Class) and Milk, Egg etc (Milk, cheese and Eggs Class).
""The average annual rate of Food inflation for the twelve months ending September 2024 over the previous twelve-month average was 37.53%, which was an 11.88% points increase from the average annual rate of change recorded in September 2023 (25.65%)."""
cassava,Fares Remain High in Akwa Ibom Despite Eno's Intervention Over High Petrol Price,https://allafrica.com/stories/202410040102.html,Nigeria: Fares Remain High in Akwa Ibom Despite Eno's Intervention Over High Petrol Price,4 October 2024,Premium Times (Abuja),http://premiumtimesng.com/,https://www.premiumtimesng.com/regional/south-south-regional/741796-fares-remain-high-in-akwa-ibom-despite-enos-intervention-over-high-petrol-price.html,"Although the petrol price has reduced drastically, the cost of transportation remains high in the state capital, Uyo.
Fares have remained high in Uyo, Akwa Ibom State, almost two weeks after Governor Umo Eno intervened in the price of petrol which had risen to N2,500 per litre in the state.
The price of petrol had climbed high in the state after the Independent Petroleum Marketers Association of Nigeria (IPMAN) in the state last month directed members to withdraw services over the alleged confiscation of petrol trucks by the Joint Task Force on Security.
Within hours of IPMAN members shutting down filling stations, the price of petrol rose from N1 350 to between N2 200 and N2 500. Because of this development, transport costs tripled in Akwa Ibom, forcing the Nigeria Labour Congress (NLC) in the state to ask government workers to withdraw their services and stay at home.
The NLC chairperson in Akwa Ibom, Sunny James, said the situation had worsened the condition of the already impoverished workers in the state.
In an apparent move to prevent government workers from withdrawing service, Governor Eno intervened in the matter and met with the petroleum marketers, who then resumed sales of petrol to the public.
Although the governor's intervention reduced the price of petrol from N2,500 to between N1,100 and N1,400 in Uyo, the transport cost has remained high.
Fares
Although fares had increased throughout the country after President Bola Tinubu last year declared an end to petrol subsidy, a fiscal policy that has pushed the inflation rate to an unprecedented level, sent food prices tripling and resulted in an unprecedented cost-of-living crisis.
But fares were not this high in Uyo until IPMAN directed members to shut down filling stations.
For instance, before the marketers' action, commercial buses and tricycle operators charged N100 from Ibom Plaza to Itam Junction, which is within the heart of Uyo city. Commuters now pay N200 for the same distance, indicating a 100 per cent increase.
Also, the fare from Ibom Plaza to Ibiaku U-turn, along Oron Road in Uyo, which used to be N400, is now N600.
Fares for different routes in Uyo and other parts of Akwa Ibom have skyrocketed, forcing many residents to resort to trekking.
Passengers blaming wrong persons - transport operator
In an interview with PREMIUM TIMES on Thursday, a commercial bus driver in the state, Monday Akpan, admitted that the price of petrol has reduced after Governor Eno's intervention but said it would be difficult to reduce fares.
Mr Akpan said transport operators were ""forced to manage"" the former price regime despite their discomfort with it.
""Passengers are blaming the wrong persons. We are charging passengers depending on how we buy petrol.
""Early last year, we bought fuel at N190, but now it is as high as N2,000. The passengers should channel the blame to appropriate quarters and stop blaming commercial drivers.
""They should blame the government,"" Mr Akpan said.
Another operator, Nsikak Sam, corroborated Mr Akpan's view.
Mr Sam said it has been difficult for commercial drivers to recover the money they spent on fuel, but that he and his colleagues have to ""manage"" due to obligations to their family.
""Yesterday (Wednesday), I bought petrol N7,000 in the morning but only realised N3,000 by the time the petrol finished,"" Mr Akpan said, arguing that the price of petrol was still high, the reason he said there were now fewer cars on the road, in the state.
A tricycle operator in Uyo, Kufre Okon, narrated how he spent over eight hours queuing for petrol at an NNPC retail outlet in the city, only for the petrol to finish at the filing station before it got to his turn.
Mr Okon said transport operators hardly recover the money they use in buying petrol.
In addition to the petrol price, Nigerians are facing hard times as the economy deteriorates daily, with prices of basic commodities skyrocketing beyond the reach of ordinary Nigerians.
For instance, garri, a staple made from cassava, traditionally the cheapest of raw foods, has become a luxury. The price of other staples, including rice and beans, is also high as Nigerians battle the cost-of-living crisis."
