Crops,Original_Search_Title,Link,Headline,Date,Publisher,Publisher_URL,Source_URL,Body_Text
sorghum,Industrial Manufacturing Must Be At the Core of AfCFTA - AfDB's Adesina,https://allafrica.com/stories/202405280405.html,Rwanda: Industrial Manufacturing Must Be At the Core of AfCFTA - AfDB's Adesina,28 May 2024,The New Times (Kigali),http://www.newtimes.co.rw/,https://www.newtimes.co.rw/article/17148/news/africa/industrial-manufacturing-must-be-at-the-core-of-afcfta-afdbs-adesina,"The African Continental Free Trade Area (AfCFTA) is not merely about trade but rather putting in place industrial policies that facilitate the accelerated development of manufacturing industries, said Akinwumi Adesina, the President of the African Development Bank (AfDB).
ALSO READ: Kagame to attend African Development Bank meet in Kenya
He was speaking during a media briefing, on May 27, at the start of the five-day AfDB Annual Meeting, in Nairobi, Kenya.
Themed 'Africa's Transformation, African Development Bank Group, and Reform of the Global Financial Architecture', the meeting comprises the 59th Annual Assembly of the African Development Bank and the 50th meeting of the African Development Fund.
It brings together key officials of bilateral and multilateral development agencies, leading academics and representatives of non-governmental organizations, civil society, and the private sector to engage in high level discussions that seeks the socioeconomic transformation of the continent.
Adesina noted that Africa's transformation will greatly depend on the realization of AfCFTA's potential, precisely in developing industrial manufacturing that allows specialization in value chains of which the continent has a comparative advantage for national, regional, and global markets.
""Simply trading is not enough. We have been trading forever and our forefathers have been doing so. But if I trade maize, and you trade sorghum in a free trade zone, both of us are going to be competitively and efficiently poor,"" he said.
ALSO READ: Africa's industrialization doesn't depend on outside influence - Kagame
According to him, industrial manufacturing should be at the core of Africa's transformation because it allows the continent to expand its exports around the world.
""So, when I talk about infrastructure, it's not about connecting a village to a village but the introduction of corridors and strategic infrastructure platforms that allow Africa to stand strong and competitive.""
He mentioned the Lobito corridor that connects Angola to Zambia and DR Congo, the central corridor of railway that links Tanzania to Burundi, the Desert to Power initiative that seeks to make the Sahel the world's largest solar production zone with up to 10,000 MW of solar generation capacity.
Global financial architecture and Africa debts
In the past 10 years, 19 African countries issued more than $200 billion in Eurobonds taking advantage of the low interest rates. According to Adesine, with the current depreciation and contractionary monetary policy in the Eurozone and the US, the cost of debt service has gone over the roof.
""It's not just about countries borrowing, they need more concessional financing which should be followed by efficient use of the borrowed money in public expenditures,"" he said.
Additionally, he noted, the needed change in the global financial architecture is for Africa not to be penalized on the account of unfair risk assessment.
ALSO READ: Kagame: Now is the time to make international financial system fit for purpose
According to UNDP, if African risks are appropriately and fairly estimated, African countries would save $75 billion per year in their debt service.
Africa's external debt has almost doubled since 2010, from 21.2 percent to 38.6 percent of GDP in 2022, and debt service payment has increased from 3.5 percent to around 6 percent of GDP under the same period, absorbing about 11.3 percent of government revenue in Africa.
Changing of the financial architecture also looks at Africa's Special Drawing Rights (SDR). Adesina announced that the board of the International Monetary Fund allowed $20 billion as a limit of SDRs to be rechanneled towards hybrid capital to be used by multilateral development institutions.
Domestic resource mobilization
Another important topic that will continually be discussed at the meeting is mobilizing domestic resources for Africa's transformation, which is currently structurally insufficient.
This includes the instruments to attract private capital and how to efficiently manage it, prevent illicit capital flows, and more money lost in corruption."
sorghum,First Lady Hosts Gota/Nhanga/ Ixhiba for Learners At Children's Party,https://allafrica.com/stories/202404180493.html,Zimbabwe: First Lady Hosts Gota/Nhanga/ Ixhiba for Learners At Children's Party,18 April 2024,The Herald (Harare),https://www.heraldonline.co.zw,https://www.herald.co.zw/first-lady-hosts-gota-nhanga-ixhiba-for-learners-at-childrens-party/,"
THOUSANDS of learners from the country's 10 provinces were yesterday treated to a Children's Party with a difference, thanks to First Lady Dr Auxillia Mnangagwa who held a special Nhanga/Gota/Ixhiba session for them reinforcing the need for them to focus on their studies, exercise self-discipline and shun peer pressure, drugs and early sexual relationships.
A disturbing new trend was revealed during Nhanga session that some girls were conspiring with their friends to lure their fathers into romantic relationships to milk them of money. Such relationships were also cited as reasons behind a surge in sexually transmitted infections, early pregnancies leading to even suicides.
The Children's party is an annual event that precedes Independence Day celebrations and is hosted by the President and First Lady.
During the Nhanga/Gota/Ixhiba, there were various chores which were showcased by both boys and girls.
The activities included grinding on stone, pounding and preparing traditional dishes.
Children were also taught to slaughter and dress road runner chickens, prepare dried vegetables, vegetables mixed with beef, kapenta in peanut butter, madhumbe, magogoya, mutakura, sadza rezviyo and mhunga among other mouth watering cuisines.
While girls were in Nhanga with the First Lady, spouses of chiefs and elderly women, boys were in the Gota with chiefs and elderly men.
Boys were taught to slaughter a goat and prepare it for the pot.
Boys being taught traditional values, norms and culture by Chief Chitsunge during a Gota programme which was organised by First Lady Dr Auxillia Mnangagwa at the 44th Independence celebrations Children's party in Murambinda yesterday
The mother of the nation implored the children to embrace her life teachings so that they can live exemplary lives.
""My children today I have come to speak to you in the company of elderly women. We want to discuss everything and you should not be shy. Vanambuya, we want to catch them young before they delve into bad behaviours. If there is anyone who was lost we correct her,"" she said.
""Nhai vanangu chii chinombonzi musikana akakwana,"" the First Lady asked. In response, the girls said a girl who has never slept with a man.
She went further and asked the challenges associated with early sexual relations whereupon the children pointed at diseases, pregnancy and the prospects of dropping out of school.
""My daughters do not get infamous for being a girl of loose morals. Value your body, refuse to be fondled by boys. Do you know that you are precious and your body is the temple of the Lord therefore stay pure? Education is key, say no to early sexual relationships. Value your virginity. I want you to earn new titles in the future through professions. What would you want to be when you grow up,"" she said.
The question triggered a lot of responses including Doctor, Pilot, Lawyer, Magistrate, Nurse, soldier and Teacher.
""My daughters, you can accomplish all this through perseverance in school. Stay in school and work hard. You have the capacity to change your background. I am glad you came from all the provinces countrywide and please teach others when you go back. We say no to peer pressure and we say no to those who return from boarding schools while pregnant. Select your friends wisely.
Girls ask questions during an interactive Nhanga programme with First Lady Dr Auxillia Mnangagwa and elderly women at the 44th Independence celebrations Children's party in Murambinda, Manicaland yesterday
The girls then burst into songs ""Humhandara hwedu Jehova ndimi munohuziva tichengetei"" and ""Chengeta chikwama chababa chine madhora.""
They also sang the famous song by young girls called ""Dont touch, apa pangu, dont touch"".
Gogo Getrude Chigwedere gave the children a lecture on morals.
""We must be morally upright. When some wake up they cannot greet their parents. When one wakes up they are immediately on the phone before even washing their faces or sweeping the yard. You do not even have the time to cook and you get to the point of burning the relish while on social media and you are assimilating western cultures which are alien to us,"" she said.
The wife of Chief Mutasa, Mrs Derlia Mutasa, emphasized the need for children to always be properly dressed.
""We frown upon children who wear clothes that expose their navels and miniskirts. Whom do you want to show your body to? It's not proper. Why do you sit with your legs ajar in class? What do you want the teacher to do?"" she asked.
The wife to chief Mutema, Mrs Faith Mutema, hammered on the need for girls to value their virginity as emphasized by the First Lady.
""Once you lose your virginity, it's gone forever. Your age demands that you concentrate on your school work. If you chase two rabbits you end up nowhere. That is why Amai is here to tell you the importance of education. We look forward to being looked after by yourselves but when you chase drugs like mutoriro, will you be dignified people in future?"" she said.
Girls prepare Zimbabwean traditional dishes during the Nhanga programme organised by First Lady Dr Auxillia Mnangagwa at the 44th Independence celebrations Children's party in Murambinda, Manicaland yesterday
Mbuya Gracious Chigwiti said it was critical for children to always be disciplined.
""When some of you are bought new school uniforms, they rush to have them altered into miniskirts by tailors. Why is that so?""
In response, Tanaka Chiware said they will be after seducing teachers and boys.
""This is naughtiness. When proposed by the teacher then what next? Our mother said do not rush into relationships before the time is ripe. When you are bought a long uniform which covers the knees, keep it like that and not move with legs in the open to invite men,"" she said.
The First Lady taught the girls on good menstrual hygiene and spoke on the advantages of reusable pads which she then donated to the girls.
Amai Mnangagwa added,""When some teenage children wake up, they rush into their parents' bedrooms while they are still sleeping and go further to sit on their bed. Vanangu, is this happening?""
The children said such was happening at their homes.
""Is that good,"" she asked and the children said no.
Amai spoke strongly against this.
Mrs Angeline Gata spoke on drugs and their dangers.
The First Lady taught the girls household chores that they must perform from the time they wake up.
Natasha Tendai Mavunga from Mashonaland Central Province thanked the First Lady for her educative programme.
""I want to thank the First Lady for her programme and I am happy that there are some people who watch over us outside our parents seeing how we are faring. Amai, we are grateful. What Amai said here is exactly what is happening in our communities. There are situations where relationships that are monitored by our parents, teachers and people close to us are not the ones that have challenges. Cases of blessers and minors' relationships are affecting us. What is happening these days is that, if my friend's father proposes love to me, my friend would actually convince me to date him and benefit financially. It's now the norm. These blessers are affecting us because we shall pay for these things they give us in future. Even if we discover there are five of us dating this man, we are not moved because we will be after the money. Our mother promised to focus on such issues in both rural and urban areas,"" she said.
Natasha said the elderly men will sometimes be sick and this resulted in some girls committing suicide.
It was a hive of activity in the Gota where chiefs and elders met the boys.
Chief Chimombe Bvumavaranda from Gaza in Buhera praised the First Lady for her Gota/Nhanga teachings.
""What is critical about the teachings is that they protect our children from social ills and make them grow morally upright. We taught the boys to desist from taking alcohol and drugs because these cause loss of self control. Nowadays some children are beating up their fathers which is an abomination. We do not want this and this is why we told the children to honour their parents and not to speak back at them. In our traditional courts, we have cases of children beating their parents while intoxicated,"" he said.
Mr Aleck Mangongo from Murambinda said the First Lady's teachings were ideal for nation-building.
""It is essential that boys be taught various chores and understand them so that when they meet challenges in the future they succeed. Social media is contaminating our culture whereby boys just meet a girl on a bus and do not take time to know her. Such teachings have made people know their culture because we may face challenges in the future. In the face of climate change, they do not know how to adapt. May this programme grow so that children know fully how our lives as Zimbabwean people are morphed. As a man I must know all household chores and marry someone whom I know to be well-mannered. Our mother has done well and must carry forward with this programme because if our children lose norms and values, they become useless,"" he said.
Jasper Mahaja said he had learnt a lot from the programme.
""I learnt that as boys we must preserve our African norms and values as well as our land. We learnt that we must obey our fathers as they teach us what they came through as they were growing up and what we are expected to do for us to have a brighter future. Norms and values give us character and we must be disciplined so that we can live well. We were told of the value of totems. They taught us to respect girls as our sisters by not sleeping with them before time is right. We were told to observe chastity and prepare for the future,"" he said.
After seperate sessions, Amai Mnangagwa addressed both the boys and girls.
She urged the learners to draw valuable lessons from the programme so that they have a bright future.
""I want to give you a formula that will protect you in life. I was pained that some girls are plotting against their fathers, literally finding sugar daddies for their peers. Peer pressure is ruinous. Find a friend whose character matches yours. Vana vangu vakomana, how do you feel after impregnating a girl and she drops out of school? If you were involved in such mischief, from today be a changed person using the lessons you learnt in the Gota/Nhanga. Drugs are wreaking havoc across the world and some people in other countries are digging up corpses to get high on human bones. Is that proper boys and girls? Let' stay away from drugs and stay in school. Self-discipline is very important even when you get an opportunity to learn outside the country, stick to your manners. We have our norms and values as Zimbabweans and do not dilute them with western cultures,"" she said.
The First Lady held an eating competition for both boys and girls eating the traditional food the girls cooked.
Winners were given prizes by Amai.
To make the competition interesting people were being given covered plates and asked to check what was inside.
There was sorghum sadza and dried vegetables in peanut butter, sorghum sadza and road runner, rice in peanut butter and kapenta, white sadza and vegetables mixed with beef which is popularly known as Haifiridzi.
A young boy asked as to whether traditional dishes like sorghum had any side effects whereupon the First Lady responded: ""Nowadays you are affected by modern life. If our traditional dishes had side effects, our ancestors would not live as long as they did. This food is healthy and medicinal and I urge you all to embrace and consume it.""
Chief Mutasa said he had been touched by the question.
""I was touched by this boy who spoke about side effects in relation to traditional food. That is not so my children. Please learn and understand. Do not go for refined foods, because our own food is wholesome and healthy. I eat traditional food at home and I am proud of this,"" he said.
The First Lady gave all the children who attended some goodies."
sorghum,"As Naira Gains in Forex Markets, Inflationary Pressures Persist",https://allafrica.com/stories/202404160140.html,"Nigeria: As Naira Gains in Forex Markets, Inflationary Pressures Persist",16 April 2024,Premium Times (Abuja),http://premiumtimesng.com/,https://www.premiumtimesng.com/business/business-data/686419-as-naira-gains-in-forex-markets-inflationary-pressures-persist.html,"Despite a significant appreciation recorded in the value of the naira in recent weeks, the impacts on the prices of goods and services are yet to be felt by Nigerians
As Naira appreciated further against the United States dollar across both the authorised and unauthorised foreign exchange markets on Monday, inflationary pressures persisted across the country.
According to market data published on the FMDQ website, naira closed Monday at N1,136.04/$1 against N1,142.38 recorded in the previous market session last Friday.
Monday's gain represents a 0.6 per cent appreciation from N1,142.38 posted last Friday.
The domestic currency experienced an intraday high of N1,000 and a low of N1,227.00 to a dollar before it eventually closed at N1,136.0/$1 on Monday.
The naira recorded a foreign exchange turnover of $251.60 million on Monday, the official market data showed.
At the parallel market on Monday, the domestic currency also appreciated.
Bureau De Change operators at the Abuja Zone 4 who spoke with this medium said the dollar was exchanged at N1,020 and above to a dollar on Monday and sold at N1,030 and above, as against the N1,100/$1 it was exchanged on Sunday.
The recent gains recorded by the local currency at both the official and unofficial markets these past weeks came amidst ongoing efforts by the government to stabilise the currency and address inflationary pressures in the country following an unprecedented drop in the currency value.
Financial experts have attributed the recent gains of the naira to the ongoing reforms by the government after the local currency, on several occasions within the first quarter of the year, plunged to unprecedented lows.
The Central Bank of Nigeria (CBN) recently sold $10,000 to each Bureau De Change operator at a considerably lower rate to boost liquidity and curb the price distortions affecting the naira exchange rate in the forex markets.
Inflation
While some of these interventions have significantly helped the naira to bounce back from its depreciation run, inflationary pressures persist across the country.
Official figures released by the National Bureau of Statistics (NBS) earlier on Monday put Nigeria's annual inflation rate at 33.20 per cent in March from 31.70 per cent in February,
By implication, the statistics office said the March 2024 headline inflation rate increased by 1.50 per cent compared to the February 2024 headline inflation rate.
The bureau said the food inflation rate in March 2024 jumped to 40.01 per cent yearly, indicating 15.56 per cent points higher than the rate recorded in March 2023 (24.45 per cent).
Reacting to this development, an Abuja-based commodity analyst, Yusuf Ogunbiyi, said headline inflation, as reflected in the Consumer Price Index (CPI) numbers released by the NBS, continues to gallop forward despite the multiple hikes in Monetary Policy Rate (MPR).
That is most reflected in the Year-on-Year numbers as the Month-on-Month numbers seem to be receding, he argued.
""This is expected as there is usually a lag between policies such as the MPR and prices of goods and services in the economy due to higher costs of inventory still being carried by businesses,"" he said.
Moving away from official data, he said commodity prices have started to reflect the naira appreciation as major export commodities such as Sesame and Soya beans have reflected better Naira-USD conditions.
Additionally, Mr Yusuf said other commodities such as maize, sorghum and paddy rice have also witnessed declines due to the availability of imports in the market.
""The elephant in the room is how long it will take for the policy change (hike in MPR) to reflect in prices,"" he said.
On her part, Praise Ihansekhien, head of Meristem Research, said the Naira appreciation mostly impacts the core inflation index first due to the dependence of items contained in the core basket on importation.
""Food inflation makes up 51% of the inflation basket, so as the food inflation continues to rise, headline inflation will also remain high,"" she said.
She noted that prices increase faster than they often drop, even when the circumstances influencing the direction of prices change.
""In the long run, if the FX appreciation persists, we should see some moderation to price levels, but this doesn't happen as swiftly as one would expect,"" Ms Ihansekhien said.
Razaq Fatai, research and advisory lead at Vestance, a data-driven intelligence and advisory firm in Abuja, said the recent appreciation of the naira may not have substantially curbed inflation for several reasons.
He said the impact of a stronger currency on inflation typically takes time to materialise and that headline inflation is more sensitive to food prices, which have continued to rise due to domestic issues like insecurity and high production and logistics costs.
""Market participants often react more swiftly to currency depreciation than to currency appreciation when adjusting their prices. Lastly, despite the currency's appreciation, international fuel prices have surged, partially negating the benefits of a stronger naira,"" Mr Fatai said."
sorghum,Govt Donates Grains to Kano As Governor Queries Ramadan Feeding Programme,https://allafrica.com/stories/202403250366.html,Nigeria: Govt Donates Grains to Kano As Governor Queries Ramadan Feeding Programme,25 March 2024,Premium Times (Abuja),http://premiumtimesng.com/,https://www.premiumtimesng.com/news/more-news/680552-hardship-fg-donates-grains-to-kano-as-governor-queries-ramadan-feeding-programme.html,"The donation consists of 100 trucks of rice, 44 trucks of sorghum, and four trucks of maize
The federal government has donated truckloads of grains to the Kano State government for distribution to the needy.
The donation consists of 100 trucks of rice, 44 trucks of sorghum, and four trucks of maize.
The donation arrived just as the state government said it has begun an investigation into its ongoing Ramadan feeding programme in the state.
The state's Director-General, Media and Publicity, Sanusi Tofa, disclosed this to journalists on Sunday in Kano.
He said Dangote Foundation also supported the state with 120,000 10kg bags of rice.
""Aside from these donations, the State Government is giving out 145 trucks of assorted grains for distribution to the 44 local government areas and 484 wards,"" he said.
Mr Tofa said the gesture was in collaboration with the local government councils in the state.
He said the state government has also commenced an investigation into the ongoing Ramadan feeding programme in the state.
Mr Tofa said Governor Abba Yusuf had expressed dismay over the operation of the programme when he paid a surprise visit to some selected Ramadan feeding centres in the Kano metropolis.
""Yusuf expressed disappointment at what he saw at the centres, asking several questions that had no answers from the operators of the programme.
""The governor said that in the next 24 hours, the government would reorganise the feeding committee handling the exercise,"" he said.
Mr Tofa said the state government had set aside 80 feeding centres across eight local government areas and that the target was to feed 1,000 persons daily at each centre.
""Yusuf was at the feeding centres and saw what was happening, and instead of meeting the actual 1,000 targeted people, only 450 registered beneficiaries were being fed at the centres he visited,"" he said.
Mr Tofa said that because of the situation at the centres, the governor ordered the reorganisation of the committee handling the exercise.
He also ordered an investigation into the whole exercise with a view to punishing the culprits.
( NAN)"
