Crops,Original_Search_Title,Link,Headline,Date,Publisher,Publisher_URL,Source_URL,Body_Text
banana,Museveni to Meet Cultural Leader Over 'NRM Vision',https://allafrica.com/stories/202408060235.html,Uganda: Museveni to Meet Cultural Leader Over 'NRM Vision',6 August 2024,Nile Post (Kampala),https://nilepost.co.ug/,https://nilepost.co.ug/news/210549/museveni-to-meet-cultural-leader-over-nrm-vision,"President Museveni has revealed that he will be meeting cultural leaders in Uganda next month.
According to the president, the meeting will focus on sharing the National Resistance Movement (NRM) government's vision with the cultural leaders.
""We have been active from the 1960s. We started as a student movement, then we became a fighting force because of our internal politics here. We later became a political movement but we have got very strong views which we would like to share with the traditional people so that we don't clash because for us we are very firm. We cannot change,"" he said.
Museveni made the remarks on Monday while meeting a group of cultural leaders in Africa led by the Umukuka III of the Bamasaba Cultural Institution, Jude Mike Mudoma at State House,
Entebbe.
During the meeting, the president implored the cultural leaders to sensitise their people to create wealth and uplift their livelihoods.
He said as a government, they have always advocated for prosperity among Ugandans.
""Our starting point is a question. Do you want prosperity in Africa or not? If you say you do, then the question is how will it be achieved? Can it be achieved by begging Europeans? If begging was the solution, Africa by now would be rich because they have been begging for the last 70 years
almost. Begging has not worked that is why you see crises everywhere in Africa which means that the issue of prosperity is yet to be addressed,"" he said.
""Our view is that prosperity will come from each adult person producing a good or participating in producing a good or a service and selling it sustainably and getting money; that money will help me get rich and solve my problems.""
He explained that prosperity will come from wealth creation, that is why the government sends money (Parish Development Model) to villages to create wealth for every homestead.
""If you say that is the way to get prosperity, then the next question is who will buy what you produce? Our analysis, like me I'm from a tribe that keeps cows. From the cows, I get milk and beef and I sell them. When I sell them, I get money which I use to build a better house and solve my problems. We also produce bananas in my tribe. But the problem I have is that people in my tribe don't buy from me because they produce the same products like me,"" he noted.
""The ones who buy bananas and my milk and beef are the other tribes in Uganda because they are the ones who don't have what we have. They also have something that we don't have. You find that Uganda is the one which helps my tribe to be prosperous because they buy what my tribe
don't buy. That is why we tell our people that the tribe is important but love Uganda-Patriotism. Why? Because you need it for your prosperity.""
He said that when people produce more, they will realise that the local market is not enough, thus the need for the African market.
""That is why we tell our people that we also need Africa to get a market for our surplus goods. That is why our principle number two is Pan- Africanism,"" he asserted.
""Socio-economic transformation is also crucial. Our people must change. They must become modern. They can't continue being where they were before.""
Museveni cautioned the leaders against bad politics of dividing people based on tribes, saying that it hinders development.
The Umukuka expressed gratitude to President Museveni for the unwavering support towards Bugisu sub region.
""I thank you for gracing my inaugural ceremony with your presence through , the Vice President of the Republic of Uganda who ably represented you and for your support during the burial of the
late Emeritus Wamimbi when you directed that he be granted an official burial and my recent imbalu cultural festival launch in Mbale city,"" he said.
""The success of the Imbalu cultural festival launch was largely due to the support received from the government and particularly from you.We greatly appreciate your continued steering of this great nation to higher heights through your visionary leadership.""
The Umukuka also thanked President Museveni for developing the country through various initiatives like the Parish Development Model (PDM).
""As a leader of Bugisu Sub region which is my area of jurisdiction, I'm thrilled to report that we have received over Shs100 billion in just one year alone. This has never happened in my lifetime, this is a tremendous achievement and we are forever grateful for your visionary leadership in implementing this transformative program,"" he said.
""The PDM has brought unprecedented development and empowerment in our communities, and we are witnessing tangible impact on the lives of our people.""
He further pledged that as Bamasaba cultural Institution, they will continue working tirelessly to ensure the success of PDM and other government programs to build a brighter future for Ugandans.
On the other hand, the Umukuka commended President Museveni for fostering cultural institutions in Uganda through an enabling law.
""Your leadership and vision for a united Africa are truly inspiring, we are committed to walking this path with you using our culture and heritage as a foundation for our collective progress.""
His Royal Highness, Torgbui Amenya Fiti V, the President of the Forum
of Kings, Queens and Traditional Leaders in Africa, also Paramount Chief of Aflao Traditional Area-Ghana, thanked President Museveni for his spirit of Pan-Africanism and solidarity."
banana,"Wizkid, Dice Ailes Among Stars Living in Banana Island's Opulence",https://allafrica.com/stories/202408050315.html,"Nigeria: Wizkid, Dice Ailes Among Stars Living in Banana Island's Opulence",4 August 2024,Leadership (Abuja),http://www.leadership.ng,https://leadership.ng/wizkid-dice-ailes-among-stars-living-in-banana-islands-opulence/,"Musician of royal descent, Dice Ailes, who made a splash in March 2023 , by moving into his luxurious three-bedroom, three-bathroom Banana Island home, with a swimming pool has joined stars like WizKid, P-Square and other notable Nigerians in calling Banana Island home.
Banana Island, an exclusive enclave in the Lagos Lagoon, is renowned as Nigeria's most prestigious residential address. The gated community is home to a bevy of high-net-worth individuals and celebrities, drawn to its security, privacy, and opulent lifestyle.
Renowned Afrobeat artist Ayo Balogun, also known as Wizkid, owns a mansion in Banana Island. The Okoye twins, Peter and Paul of the P-Square duo, also share a lavish Banana Island residence worth over N850 million. Another famous singer, Davido, once had a luxurious apartment in Banana Island but has since moved to Boudillon and now resides in another luxury condo.
Some of Nigeria's wealthiest individuals, such as Aliko Dangote (Africa's wealthiest person), own properties worth a fortune. Dangote's property in Banana Island is worth over two billion naira, a testament to the size of his immense fortune. Mike Adenuga, the country's second-richest person and telecommunications mogul, also boasts a luxurious mansion valued at over N1.2 billion naira.
Former President Olusegun Obasanjo's daughter, Iyabo Obasanjo, also owns a multi-million naira mansion in the exclusive Banana Island community.
Similarly, Tundun Abiola, the sister of Kola Abiola, is a homeowner in this lavish neighbourhood, with her mansion valued at over N750 million. Africa's wealthiest blogger, Linda Ikeji, is also among the prestigious property owners in Banana Island, boasting a breathtaking residence valued at over N850 million."
banana,"Iconic Singer, Onyeka Onwenu Dies At 72",https://allafrica.com/stories/202407310112.html,"Nigeria: Iconic Singer, Onyeka Onwenu Dies At 72",31 July 2024,Vanguard (Lagos),http://www.vanguardngr.com/,https://www.vanguardngr.com/2024/07/breaking-iconic-singer-onyeka-onwenu-dies-at-72/,"Veteran Nigerian singer, songwriter and actress, Ms Onyeka Onwenu is dead.
According to reports the iconic singer Tuesday night after performing at an event at Banana Island, Lagos. She was 72.
Onwenu was said to have slumped after performing at the birthday ceremony of Stella Okoli, owner of Emzor Pharmaceuticals.
She was later confirmed dead at a hospital in Victoria Island, The Guardian Newspaper reported. Her family is yet to confirm the death.
Apart from her career in the arts, Onyeka Onwenu also had a career in politics. She served as chairperson of the Imo State Council for Arts and Culture and the Director-General of the National Centre for Women Development.
Onyeka Onwenu was born in 1952, in Obosi, Anambra State, Nigeria. She began her music career in the 1980s and released her debut album, ""For the Love of You,"" in 1981. She has since released numerous albums and singles, including the hit song ""One Love.""
Onwenu has also acted in several Nollywood films and has won numerous awards for her contributions to music and film. She has been recognised as one of the pioneers of Nigerian music.
In addition to her entertainment career, Onwenu has also been involved in politics. She was appointed as the Chairperson of the Imo State Council for Arts and Culture in 2013 and later became the Director-General of the National Centre for Women Development in 2016.
Onwenu has been recognized for her contributions to Nigerian society, including being awarded the National Honors of Member of the Order of the Federal Republic (MFR) in 2011. She has also been recognized as one of the most influential women in Nigeria by various organisations
Vanguard News"
banana,"Over 50,000 Residents in Mayuge Bask in Restored Health, Sanitation",https://allafrica.com/stories/202407300271.html,"Uganda: Over 50,000 Residents in Mayuge Bask in Restored Health, Sanitation",30 July 2024,Nile Post (Kampala),https://nilepost.co.ug/,https://nilepost.co.ug/news/209611/over-50000-residents-in-mayuge-bask-in-restored-health-sanitation,"As the sun prepares to set, it bounces off the slightly rusty iron sheets of a house tucked away in Wandegeya B village, Wandegeya parish in Kityerera sub county in Mayuge district. Metres away, a woman is tending to her banana garden overlooking the well tendered compound.
This is Faith Nangobi, a water, sanitation and hygiene (WASH) facilitator whose hygiene standards have also improved, because of among others of knowledge got from Lifewater International.
""Previously, we faced a challenge of diseases like Dysentery, trachoma and Cholera that mainly stemmed from poor sanitation habits. Not only in my home but the village at large, children and adults never took two months without getting infected,"" Nangobi says.
""While we had been told that this was because of poor hygiene, we improvised with makeshift latrines but the problem persisted.""
She says this was the order of the day until 2017 when Lifewater International, an NGO was introduced to their area.
Nangobi says she is lucky, her parish was chosen among the beneficiaries and she was chosen as a WASH facilitator, which meant hers was chosen as a model home.
""We were trained what to do to improve our sanitation. We were asked to have well-constructed latrines, hand washing facilities after using the latrine, a facility for keeping rubbish, a clean container for keeping drinking water, plate stand to keep utensils until dry after washing among others. We were generally taught how to do hygiene.""
She says apart from this, her home was to be a springboard for promotion of hygiene in her village as she would teach what she had learnt to her neighbours.
Nangobi says whereas many didn't like the new idea, with time, they embraced it and are living to reap the benefits.
""I am happy to note that whereas there was an outbreak of Cholera in this area, all households that listened to the WASH message were spared by the disease. The outbreak was a blessing in disguise as many other households who were despising our WASH message realised the problem was because of their hygiene and since then, they have improved.""
""Since the coming of Lifewater International, I swear to God, our lives have changed completely.""
Rev George Steven Ogwang is the parish priest for Wandegeya parish who says he was approached by the NGO to preach the gospel of sanitation and hygiene among believers.
To this, he says he was made the chairperson of at least 31 other churches from the Pentecostals, Orthodox and Catholics to implement sanitation and hygiene.
""What a church leader says, people dont question and this has helped us spread the gospel of WASH. People have responded to our messages and put in practice good hygienic practices. All people around have good latrines,"" he says.
Emmanuel Curuma, Country Director of Lifewater International Uganda.""At first they couldn't see benefit of Lifewater but when they say Church asked that people listen to the message of WASH, even the poorest homes have well-constructed pit latrines, plate stands and proper places to dispose of rubbish, unlike before.""
He says a borehole was also constructed at the Church to benefit the community.
""Due to the clean water problem, we were chanced to receive a borehole. Previously we could fetch water around midnight or 3am when the people had reduced. During the day, many people would converge at single water point but this was eased.""
Near Rev.Ogwang's church is Wandegeya Church of Uganda Primary School, also a beneficiary of Lifewater.
Samuel Batema is the headmaster at the school with over 850 learners and is a beneficiary of a two latrine blocks with 17 stances that he says has changed fortunes for the school.
""We were badly off until we got assistance by Lifewater. The latrine stances were very few and almost filled up. Children were struggling with one another to go to the latrine. One had to wait for the other to get out and also use the latrine which meant that much time was spent. This time round we even have special facilities for learners with special needs which is a good idea. The latrines are modern with very many stances,"" Batema says.
He says the fortunes were further changed with the digging of the borehole at the school.
""Children used to long distances to the nearby borehole. Learners would spend a lot of time as they had to wait for villagers to finish fetching and on many occasions could miss lessons,"" Batema says.
Some of the facilities constructed by Lifewater International Uganda,He adds that the borehole has meant that the school has enough water for even girls in the menstruation periods to always be clean.
""Previously, many of our girls could miss school during menstruation days because there wasn't enough water to clean themselves. This has however changed.""
Lawrence Makubo is a water user committee chairperson for Bubarule A , Manga zone, in Kityerera sub county .
The committee is charge of looking after boreholes constructed by LifeWater International in the different communities
""While previously we shared water with animals from ponds, the construction of boreholes helped change everything for us. We were trained on how to dig proper pit latrines, rubbish pits and how to ensure hygiene.""
He says that the water source in his area serves 58 households.
""The members of the water user committee are trained by Lifewater on how to protect the borehole. The committee is also in charge of collecting funds to be used for repairs. For example, households contribute shs1000 each which is kept in the bank and in case of breakdown, the money is withdrawn and pay for repairs.""
Nicholas Esagala is a nurse at Kitovu health centre II who says unlike before, cases of communicable diseases reported to the facility have reduced following the introduction of water, sanitation and hygiene services by Lifewater.
""Statistics show there has been a great reduction in the number of cases in terms of communicable diseases received at this facility .The households have been encouraged to ensure hygiene, construct proper latrines and consumption of clean water. Because this place is surrounded by water bodies, hygiene was one of the big problems faced. Lifewater International has changed the fortunes,""Esagala says.
He says that people have since shifted from using water from the lake to drawing it from boreholes.
According to Emmanuel Obia Curuma, the Lifewater International Uganda Country Director, they focus on ensuring they change lives of locals through sanitations.
""Our approach is to work, house-to-house, village to village, and school-to-school within the target area, ensuring that every person is reached and equipped to improve their health. We are specifically paying much attention to building and changing community mindsets through community conversations and transformations,""Curuma said.
He noted that since inception in 2017, the Lifewater International has served 50,746 people across 138 villages in Mayuge, which has seen an increase in access to clean water, sanitation, and hygiene facilities.
The number of health homes has risen to 7,749, while the number of Open Defecation-Free communities has jumped to 138, up from a few in 2017.
The project also added 161 water points to the community and institutions.
Lifewater International has also constructed 50 latrine blocks while at least 287 church leaders have been trained in WASH issues, leading to a significant increase in health churches with decent latrines and water points, now standing at 59.
""Our work really focuses on mindset and behavior change of the community members. All the other things you see, such as water points and modern latrines, are the last bit of our work. The real work is on mindset and ensuring that we change the behavior of the people to adopt healthy living practices,""Curuma said.
Speaking during the commissioning of completed projects in Kityerera sub county, Lukia Isanga Nakadama, the Mayuge Woman MP and Third Deputy Prime Minister commended Lifewater International for its life-changing projects.
""Improved menstrual hygiene facilities will continue enable girls to stay in school. Previously, girls would often miss school due to lack of access to clean water during their menstrual cycles. These projects are a relief,"" Nakadama said.
She urged locals to own the projects to ensure their sustainability.
""It's not Lifewater's project; it's ours because these schools are ours,"" she stressed.
Nakadama encouraged other NGOs to emulate Lifewater International's model to make impact in local communities."
banana,Former Blantyre City Mayor Wild Ndipo Eyes Parliamentary Seat,https://allafrica.com/stories/202407240202.html,Malawi: Former Blantyre City Mayor Wild Ndipo Eyes Parliamentary Seat,24 July 2024,Nyasa Times (Leeds),http://www.nyasatimes.com/,https://www.nyasatimes.com/former-blantyre-city-mayor-wild-ndipo-eyes-parliamentary-seat/,"The immediate past Blantyre city mayor, his worship councillor Wild Ndipo of Chigumula wards has outlined his plans of standing as the member of Parliament for Blantyre city east during the next year's tripartite general elections.
Speaking in an exclusive interview just after the Blantyre city mayors' elections held on Monday, Ndipo said his focus is now to serve his people in Parliament next year.
"" Its likely that people have been impressed with how I have executed my duties during my tenure that is why they have endorsed me to stand as a member of Parliament for the Chigumula -BCA-Club Banana constituency next year,"" he said
Among others, the former mayor said he managed to bring back the city's lost glory by reintroducing the city street lights, constructions of roads and schools and one way traffic management system.
Ndipo said he thought of giving others a chance to lead the mayoral position.
"" Iam happy to see them winning the highly contested seats respectively and taking over from me. This is awesome. You know what? A good dancer knows when to stop, I have done my part,"" said a vividly smiling Ndipo.
The former mayor added that he was impressed with the first ever free and fair elections in the history.
"" My advice to the newly elected people is that these are strategic positions that need to address residents' concerns as well as working together for the common goals,"" said Ndipo
According to him, he has left the mayoral position a happy person after achieving what he put in stock.
Councillor Wild Ndipo has served for 10 years, served as deputy mayor for(2.5 years) and mayor for (7.5 years) respectively, making him the longest serving mayor in the history of Blantyre city and Malawi at large.
Ndipo subsequently served as president of Malawi Local Government Association ( MALGA) for 6 years and as a board member of the local government finance committee for 3 years."
