Crops,Original_Search_Title,Link,Headline,Date,Publisher,Publisher_URL,Source_URL,Body_Text
cassava,Citizens Urged to Vote for PNC,https://allafrica.com/stories/200811110502.html,Ghana: Citizens Urged to Vote for PNC,5 November 2008,Accra Mail (Accra),N/A,N/A,"Hajia Alima Ali, National Women Organiser of the People's National Convention (PNC), has called on Ghanaians to vote for the party on 7 December for peace and unity.
She also urged the electorate to vote against the New Patriotic Party (NPP) and National Democratic Congress (NDC) in the December 7 polls because the two parties were not trustworthy."
banana;cassava;sorghum,Soroti Scientists to Revive Cotton Growing,https://allafrica.com/stories/200811060393.html,Uganda: Soroti Scientists to Revive Cotton Growing,5 November 2008,The Monitor (Kampala),N/A,N/A,"Scientists in Soroti are set to start a research in the genetically modified cotton in a bid to rescue farmers from the conventional cotton which had suffered a set back in production due to the ball warm pest thereby resulting into poor yields.
The Director of the National Semi Arid Resources Research Institute, Serere (NaSARRI), Dr Tom Areke with his team have already ploughed approximately one acre of land on the institute land for the field trials."
cassava,Closing the National Poverty Gap,https://allafrica.com/stories/200811061009.html,Ghana: Closing the National Poverty Gap,4 November 2008,Africa Renewal (United Nations),N/A,N/A,"Tamale — Many of the women at the workshop of the Pagsung shea butter association are in their forties and fifties. Previously, each had collected and processed shea nuts as an individual, but earned so little she could barely get by. ""We found if we came together we could make more and sell more,"" explains Safiya Hassan, a recent university graduate who is helping the women.
Mixing shea butter for soap production in Tamale, the capital of Ghana's Northern Region: For poor women, even modest increases in their incomes can make a big difference."
banana;cassava,A United Front Gives a Better Platform,https://allafrica.com/stories/200811050225.html,Uganda: A United Front Gives a Better Platform,4 November 2008,The Monitor (Kampala),N/A,N/A,"Can Ugandan farmers unite and form a strong body and can they influence the government to come up with farmer friendly policies? Can farmers make an impact on government decisions about such issues as the environment, biotechnology or budgetary allocations to agriculture?
Are they capable of lobbying for resources to improve production and productivity? Are they in position to create strong marketing systems for their produce within and outside the country? Are they empowered to determine their own prices for their produce?"
cassava,"Rebels Beheaded Civilians, Says Victim",https://allafrica.com/stories/200811040850.html,"Sierra Leone: Rebels Beheaded Civilians, Says Victim",4 November 2008,Concord Times (Freetown),N/A,N/A,"The Hague — A war victim has told the trial for former Liberian President Charles Taylor in The Hague that rebels decapitated human beings during the war in Sierra Leone.
The prosecution witness Mustapha Mansaray, 60, said in 1993 rebels hacked off the heads of civilians including his uncle, Jibril Turay and connected them to a rope used to man checkpoints in Maola, Pujehun district."
cassava,Country Produces More Rice,https://allafrica.com/stories/200811040065.html,Uganda: Country Produces More Rice,3 November 2008,New Vision (Kampala),N/A,N/A,"Kampala — RICE production in Uganda has increased from 50,000 to 170,000 tonnes per annum.
This has made the country reduce rice imports from 60,000 metric tones in 2005 to 35,000 tonnes in 2007, saving about $30m in the process and improving food security, the state minister for fisheries, Fred Mukisa, has said."
cassava,Kyabazinga Storm Brews,https://allafrica.com/stories/200811030455.html,Uganda: Kyabazinga Storm Brews,2 November 2008,The Monitor (Kampala),N/A,N/A,"They depend on fene (jack fruit) for survival. Sometimes jiggers harass them. The main tarmac road passing through the sub-region is used for drying cassava because there is little economic activity.
Poverty is the main story. But they have regularly overwhelmingly voted NRM and for President Yoweri Museveni. These fellows are known as the Basoga peasants. However, it appears their marriage is getting rocky."
cassava;plantain;yam,Abacha Years - How Wole Soyinka Relocated to US,https://allafrica.com/stories/200811030411.html,Nigeria: Abacha Years - How Wole Soyinka Relocated to US,2 November 2008,Vanguard (Lagos),N/A,N/A,"Professor Wole Soyinka - the Nobel Prize winner - flew into Frankfurt, Germany on October 15 to receive the first Maikgrafin Wilhelmine prize awarded him by the city and University of Bayreuth.
As he came out of the plane, Soyinka walked briskly pass the arrival hall. He was the first person to pass through the entry gate. He was received by Mr. Gerd Meuer, his journalist friend and German translator of over four decades. For Meuer, that was not a surprise because he had known Soyinka to be a ""light traveller"" over the years. He knew Soyinka as someone who travels ""with a tiny cabin-troller, so he doesn't have to wait for any luggage."""
cassava,Investigate Teacher for Using Pupils for Labour- Parent,https://allafrica.com/stories/200811031145.html,Ghana: Investigate Teacher for Using Pupils for Labour- Parent,1 November 2008,Accra Mail (Accra),N/A,N/A,"Mrs Sarah Abban, a parent, has appealed to the Director-General of the Ghana Education Service (GES) to launch a full scale investigations into the alleged use of pupils for labour ""on contract hours"" by the head teacher of the Gomoa Brofoyeduru Catholic Primary School.
She said using pupils during school hours was against the rules and regulations of GES, but Mr John K Fenu, head teacher is alleged of doing so."
banana;cassava;sorghum,Climate Change Can Be Managed,https://allafrica.com/stories/200811030115.html,Uganda: Climate Change Can Be Managed,1 November 2008,New Vision (Kampala),N/A,N/A,"Kampala — UGANDANS have been urged to take advantage of the current rise in global food prices to grow food which will supplement their salary as well as other income.
But Africa, and indeed the world, still faces a stiff challenge of sustaining food production in the light of climate change."
cassava,Lease Holders Destroying Forests,https://allafrica.com/stories/200811010094.html,Uganda: Lease Holders Destroying Forests,1 November 2008,The Monitor (Kampala),N/A,N/A,"Hoima — Patrick Katabaazi,32, has a rice garden in Kasogoire Forest Reserve in Hoima District. ""The soils here are very fertile, I expect to harvest more than 200 bags out of this (rice) garden"" Mr Katabaazi says. He anticipates to earn about Shs2 million if he sales his harvest at 1,000 per kilogram. Little does he mind that his garden is in an environment conservation area.
He is among several people who the National Forestry Authority (NFA) officials are accusing of encroachment and failing the conservation efforts. This is after the NFA offered land in selected central forest reserves to private developers to plant trees for sustainable conservation efforts."
cassava;sorghum,Army Promotes Agriculture in Karamoja Region,https://allafrica.com/stories/200811010092.html,Uganda: Army Promotes Agriculture in Karamoja Region,1 November 2008,The Monitor (Kampala),N/A,N/A,"Karamoja — In an unprecedented move, the Uganda People's Defence Forces has joined hands with residents in the famine stricken Karamoja region to engage in mass agriculture.
Despite the long spells of drought in the sub-region, this year's harvests from a few farmers visited during the tour of the area reflect that the region has fertile soils that can support the growth of sim sim, beans, maize, sunflower, millet, sorghum, potatoes, onions and cassava among others."
banana;cassava,Nyarugenge Residents Query KCC's Valuation Process,https://allafrica.com/stories/200811010044.html,Rwanda: Nyarugenge Residents Query KCC's Valuation Process,1 November 2008,The New Times (Kigali),N/A,N/A,"Kigali — Residents of Nyarugenge District who are supposed to be relocated to pave way for for the implementation of the City's 50-year master plan have complained that the valuation of their property is being done unfairly.
The residents from the ten sectors of Nyarugenge district told the Mayor Nyarugenge, Origene Rutayisire, and the Vice Mayor of Kigali City Council Jeanne d'Arc Gakuba, that the valuation specialists are valuing property without the owners' participation."
cassava,Villagers Resort to Wild Fruits As Food Shortages Worsen,https://allafrica.com/stories/200810310963.html,Zimbabwe: Villagers Resort to Wild Fruits As Food Shortages Worsen,31 October 2008,Zimbabwe Independent (Harare),N/A,N/A,"Dubula Dumezweni Sibanda (77) holds his head in his hands as he narrates the ordeal people in Lupane District and millions of other Zimbabweans are faced with as a result of hunger due to acute food shortages.
Sibanda, who is taking care of six grandchildren, says people in his district are now surviving on wild fruits and roots from edible local plants and trees."
cassava,Will Jatropha Invade?,https://allafrica.com/stories/200810310725.html,Mozambique: Will Jatropha Invade?,30 October 2008,Fahamu (Oxford),N/A,N/A,"Reflecting on the fifth International Via Campesina Conference held in Maputo, Mozambique, on 19 October, John E. Peck examines the ongoing struggle around 'biofuels' and unpacks the extent to which global discourses on solutions climate change have been commandeered by multinational corporations. With a particular focus on Jatropha, the author explores the crop's likely impact in Mozambique and the consequences for food sovereignty, land use, and contested resources, and argues that true progress towards sustainable agriculture will only be attained once governments cease to emphasise agro-fuel subsidies.
On 19 October 2008, at the opening ceremony of the Fifth International Via Campesina Conference in Maputo, Mozambique, over 600 representatives from 50-plus countries were gathered to hear a welcome address by the President of the Republic of Mozambique, Armando EmÃƒÂ­io Guebuza. While President Guebuza had some encouraging remarks about the future potential of peasant agriculture, his suggestion that Jatropha was a solution for Mozambique's energy crisis was not well received by many in the audience. Jatropha is but one of a whole host of crops (including maize, soya, canola, sugarcane, cassava, sunflower, palm, coconut, and castor among others) now being aggressively promoted as feedstock for the global agro-fuel industrial complex. Such crops, often genetically engineered, grown in monoculture plantations, and destined for export markets, hardly deserve to be called 'biofuels' since they have no life-affirming qualities and undermine all the basic principles of food sovereignty."
cassava,Clandestine Cannabis Farmers Feed Growing Drug Abuse,https://allafrica.com/stories/200810310029.html,Africa: Clandestine Cannabis Farmers Feed Growing Drug Abuse,30 October 2008,UN Integrated Regional Information Networks,N/A,N/A,"Praia — Farmers in West Africa are turning to cannabis as a quick cash crop, feeding the biggest illegal drug market in the world.
UN Office on Drugs and Crime's (UNODC) director for West Africa, Antonio Mazzitelli, told IRIN clandestine farmers are lured by quick earnings: ""Faced with the choice of cannabis or cassava, some choose easy money."""
cassava,NEPC Tasks Tobacco Manufacturers on Diversification,https://allafrica.com/stories/200810300122.html,Nigeria: NEPC Tasks Tobacco Manufacturers on Diversification,30 October 2008,Vanguard (Lagos),N/A,N/A,"The Nigerian Export Pro-motion Council (NEPC) has urged tobacco manufacturers in the country to diversify into other non-oil export businesses that can generate jobs, good profit and foreign exchange earnings.
They also said NEPC can initiate establishment of Industrial Parks in a Public/Private Partnership arrangement to help the small and medium enterprises ameliorate their challenges given the current state of infrastructure facilities. This could be taken as part of the tobacco sector's social responsibility to the Nigerian community."
cassava;sweet potato,Survival Recipe Book,https://allafrica.com/stories/200810290757.html,Zimbabwe: Survival Recipe Book,29 October 2008,UN Integrated Regional Information Networks,N/A,N/A,"Bulawayo — Rural Zimbabweans have always turned to an emergency larder of wild foods to see them through hard times, but in this year of shortages and dizzying prices for all basic foodstuffs, the fruits and roots foraged from the bush are keeping many alive.
In the southern province of Matabeleland North, villagers are relying on a variety of wild fruits, tubers and okra-like vegetables, which become more abundant as the rainy season progresses."
cassava,Students Commend Varsity's Work-Study Programme,https://allafrica.com/stories/200810290574.html,Nigeria: Students Commend Varsity's Work-Study Programme,28 October 2008,This Day (Lagos),N/A,N/A,"Lagos — Three years after the university established the Obafemi Awolowo University Students' Support Services (OAUSSS), also known as the Work-Study Programme, some beneficiaries testify that the initiative not only provides financial assistance, but life-long skills as well. Uchechukwu Nnaike reports
The Obafemi Awolowo University Students' Support Services (OAUSSS), also known as the Work-Study Programme, was conceived in 2000 when the former Vice-Chancellor, Prof. Roger Makanjuola invited Dr. Stella Williams to prepare a proposal. It eventually began during the 2004/2005 session, when a committee was set up to start it with 300 indigent students."
cassava,"'Agric, Food Security Remains Nepad's Priorities'",https://allafrica.com/stories/200810290519.html,"Africa: 'Agric, Food Security Remains Nepad's Priorities'",28 October 2008,This Day (Lagos),N/A,N/A,"Jos — National Coordinator of New Partnership for African Development (NEPAD) and Special Assistant to President Umaru Yar'Adua on NEPAD, Ambassador Tunji Olagbunji, has described agriculture and food security as top priority issues of the programme in Africa.
Olagbunji stated this at a two day retreat for NEPAD-Nigeria senior officers held at the National Institute for Policy and Strategies Studies( NIPSS) Kuru in Plateau State."
cassava,Ijwere Pleads for Development of Niger Delta,https://allafrica.com/stories/200810280733.html,Nigeria: Ijwere Pleads for Development of Niger Delta,27 October 2008,Daily Independent (Lagos),N/A,N/A,"Lagos — Ten years after the October 17, 1998 pipeline fire disaster that occurred at Atiwor in Jesse, a satellite village in Idjerhe clan in Delta State, leaders from across the country gathered recently at the spot to mark the 10th memorial service.
The essence of the Jesse Summit organised by Green News in collaboration with the New Partnership for Africa's Development (NEPAD) was to fine-tune the best possible ways of creating new investment opportunities that would promote sustainable development for the community."
cassava,Benue Agric Varsity VC Canvasses Self Sufficiency in Food Production,https://allafrica.com/stories/200810271448.html,Nigeria: Benue Agric Varsity VC Canvasses Self Sufficiency in Food Production,26 October 2008,Daily Trust (Abuja),N/A,N/A,"Makurdi — The Vice-Chancellor of the University of Agriculture, Makurdi (UAM), Professor Daniel Uza has called on Nigerians to learn from the lessons of its past failures and plan very well to achieve self sufficiency in food production by the year 2020.
He said this in a paper titled, ""Food Security Policies and Programmes in Nigeria"", delivered at an International Conference on Food Security at the McGill University in Montreal, Canada."
cassava,Guebuza Launches 2008/09 Agricultural Campaign,https://allafrica.com/stories/200810271046.html,Mozambique: Guebuza Launches 2008/09 Agricultural Campaign,26 October 2008,Agencia de Informacao de Mocambique (Maputo),N/A,N/A,"Nicoadala — Hunger is one of the most cruel expressions of poverty, and one of the greatest obstacles to freeing energy and initiative for the country's social and economic development, Mozambican President Armando Guebuza declared on Friday
Speaking at the official launch of the 2008/2009 agricultural campaign in Nicoadala, in the central province of Zambezia, Guebuza stressed the continuing reality of hunger in Mozambique, with many families, in both rural and urban areas, unsure where their next meal will come from."
cassava,Lagos Still Committed to Feeding the Nation -Fashola's Wife,https://allafrica.com/stories/200810270622.html,Nigeria: Lagos Still Committed to Feeding the Nation -Fashola's Wife,26 October 2008,Vanguard (Lagos),N/A,N/A,"Tuesday 21st of October would ever remain fresh in the memory of Itedo-Alaafia/Dado community in Badagry in Lagos State when the first Modern community based agro-processing center was commissioned as part of practical demonstration of the Lagos State government to empower farmers and agro-processors that are predominantly women and are rural-based in Lagos State.
First lady of Lagos, Mrs Abimbola Fashola while commissioning the Cassava processing center said it is part of the efforts of the administration of his excellency, Mr Babatunde Raji Fashola SAN to improve the quality of lives of the people particularly women farmers who engage in the processing of Cassava to produce more with less effort and also make more money from their labour."
cassava,Local Art Mirrors the Emotions of Independence,https://allafrica.com/stories/200810270598.html,Uganda: Local Art Mirrors the Emotions of Independence,26 October 2008,The Monitor (Kampala),N/A,N/A,"As Uganda celebrated her 46th Independence anniversary slightly over two weeks ago, the country's contemporary artists convened at Nommo Gallery and exhibited works depicting the emotions that followed the attainment of self-rule.
On display was an intriguing repertoire of abstract and semi-abstract paintings, metal and wooden sculptures that evoked the deep sorrows of what the country endured on her road to independence, and of course, the revelry that accompanied this achievement. The words of one critic that authentic art must ignite an argument between an artist and his audience struck the mind by just looking at Yusuf Ssali's painting."
banana;cassava;sweet potato;yam,"Displaced First By War, Now By Elephants",https://allafrica.com/stories/200810240788.html,"Uganda: Displaced First By War, Now By Elephants",24 October 2008,UN Integrated Regional Information Networks,N/A,N/A,"Amuru — Marauding elephants in northern Uganda have added to the challenges faced by civilians trying to rebuild their lives in the wake of 20 years of civil war, destroying their crops and prompting some to return to displaced people's (IDP) camps they had only recently left.
""The villagers are scared of the elephants; some of them have sought refuge in huts they had left in the [IDP] camps,"" John Bosco Okullo, a local leader in Amuru District told IRIN."
cassava;yam,What to Do With the Land Use Act?,https://allafrica.com/stories/200810230806.html,Nigeria: What to Do With the Land Use Act?,23 October 2008,Daily Independent (Lagos),N/A,N/A,"On 29th March 1978 a rather monstrous and bizarre law of general application over Land in Nigeria, entitled The Land Use Act. 1978 came into effect.
Its explanatory Note goes thus: ""The Act vests all land comprised in the Territory of each State (except land vested in the Federal Government or its Agencies) solely in the Governor of the State who would hold such land IN TRUST (Capitals of Supplied) for the people. The Governor would henceforth be responsible for allocation of land in all urban areas to individuals resident in the State or to Organizations for residential, agricultural, commercial and other purposes while similar powers with respect to non-urban areas are conferred on Local Government."" This explanation was largely enacted in the opening clauses (Section 1 thereof) of the Act."
cassava,"Saraki Gets Food Science Institute Award, Pledges More for Agric",https://allafrica.com/stories/200810230049.html,"Nigeria: Saraki Gets Food Science Institute Award, Pledges More for Agric",23 October 2008,Vanguard (Lagos),N/A,N/A,"Kwara State Governor, Dr. Bukola Saraki, at Ogbomoso, received the Presidential Award of the Nigerian Institute of Food Science and Technology (NIFST) for Excellence in Agriculture and Food Security Initiatives at its 32nd Conference/AGM, holding in Ladoke Akintola University of Technology (LAUTECH), which began on Tuesday and ended on Thursday, 16th October, 2008.
Food scientists and technologists drawn from universities and polytechnics in the country, scholars, food manufacturers, ministries of agriculture, agencies, research organisations and students are attending the three-day conference, declared open by Osun State Deputy Governor, Erelu Olusola Obada, representing Governor Olagunsoye Oyinlola."
banana;cassava;yam,Museveni Opens 700 Million Plant Lab in Buloba,https://allafrica.com/stories/200810230110.html,Uganda: Museveni Opens 700 Million Plant Lab in Buloba,22 October 2008,New Vision (Kampala),N/A,N/A,"Kampala — PRESIDENT Yoweri Museveni has opened a laboratory that produces plant tissue.
The technology involves the production of multiple plants from a single plant in the absence of seeds or pollinators to produce seeds."
banana;cassava,Keeping It Organic,https://allafrica.com/stories/200810220752.html,Uganda: Keeping It Organic,22 October 2008,The Monitor (Kampala),N/A,N/A,"Farmers working to boost food security and improve their livelihoods in terms of incomes from the produce will now move their minds from the use of chemicals to natural organisms.
Research carried out indicates that in order to maintain food security in the country and the world over, farmers have been boosted by biological control measures of pests and diseases. Mr Kamayombi Bulegeya, a crop protection specialist says farmers can now focus on environmentally friendly methods other than the use of chemicals."
banana;cassava,Rains Ravage Southwestern Districts,https://allafrica.com/stories/200810220750.html,Uganda: Rains Ravage Southwestern Districts,22 October 2008,The Monitor (Kampala),N/A,N/A,"Isingiro — The torrential rains that have hit the southwestern districts have left thousands of locals staring hunger in the face following the destruction of their crops. The rains, which started in September, are also likely to force many of the residents to seek alternative accommodation since many homes have been destroyed.
In Isingiro and Mbarara districts, over 3,000 homes lost their gardens of beans, cassava, Irish potatoes and bananas in a series of stormy rains that hit Kabuyanda and Mwizi sub-counties."
banana;cassava;sorghum,Scientists Prepare to Fight Cotton Disease and Pests,https://allafrica.com/stories/200810220726.html,Uganda: Scientists Prepare to Fight Cotton Disease and Pests,22 October 2008,The Monitor (Kampala),N/A,N/A,"Scientists in Uganda will soon begin testing the genetically modified cotton in their laboratories to prove whether they are resistant to cotton wilt and other related cotton diseases, which has been destroying the conventional cotton plant.
The government recently gave a go ahead for scientists to carry out the above research just as they have been doing to other crops such as the East African Highland banana and cassava."
cassava,UN Helps in Local Effort to Rid Country of Marijuana,https://allafrica.com/stories/200810210003.html,Liberia: UN Helps in Local Effort to Rid Country of Marijuana,20 October 2008,UN News Service,N/A,N/A,"The United Nations is assisting Liberian National Police (LNP) tackle the drug trade in remote areas of the West African nation, with the latest joint raid bringing the total amount of marijuana seized to almost 1,000 kilograms.
UN Police (UNPOL) and a Bangladeshi battalion and a Nigerian formed police unit (FPU) serving with the UN Mission in Liberia (UNMIL) took part in the LNP-coordinated surprise operation, one of several recent efforts seeking to identify and destroy marijuana plantations, UNPOL reported today."
cassava,Councils Tasked On Food Sufficiency,https://allafrica.com/stories/200810201185.html,Nigeria: Councils Tasked On Food Sufficiency,19 October 2008,This Day (Lagos),N/A,N/A,"Lagos — Local government chieftains in Akwa Ibom State have been advised to identify and intensify efforts in the cultivation of food crops with comparative advantage that can thrive well in their localities.
Governor Godswill Akpabio stated this, while declaring open a one-day state dialogue on poverty reduction and food security to mark the 2008 World Poverty Day at the Idongesit Nkanga Secretariat, Uyo."
cassava;sorghum,State Releases Fertilizer for Sale,https://allafrica.com/stories/200810220568.html,Kenya: State Releases Fertilizer for Sale,19 October 2008,The Nation (Nairobi),N/A,N/A,"Nairobi — The government has released fertilizer worth Sh396 million to be sold to farmers in Central, Eastern and South Rift regions at a subsidised price.
Speaking in Meru over the weekend when he received 5,400 tonnes of the fertilizer for the upper eastern region, Agriculture Assistant minister Japheth Kareke said the consignment will only be sold to genuine farmers."
cassava;sweet potato,Isingiro Residents Get Relief Food,https://allafrica.com/stories/200810200583.html,Uganda: Isingiro Residents Get Relief Food,19 October 2008,New Vision (Kampala),N/A,N/A,"Kampala — OVER 3,000 residents from Isingiro south constituency have received food aid following a hailstorm that killed two people and destroyed most food crops.
The area MP, Alex Byarugaba, handed over the items to the beneficiaries on Thursday."
