Crops,Original_Search_Title,Link,Headline,Date,Publisher,Publisher_URL,Source_URL,Body_Text
banana;cassava;plantain;sorghum;sweet potato;yam,CRI Commends AGRA for Investing in Agricultural Research,https://allafrica.com/stories/200811280923.html,Ghana: CRI Commends AGRA for Investing in Agricultural Research,28 November 2008,Public Agenda (Accra),N/A,N/A,"Kumasi — The Director at the Crop Research Institute (CRI) at the Council for Scientific and Industrial Research (CSIR), Dr. Hans Adu-Dappah has commended the Alliance for a Green Revolution in Africa (AGRA) for investing into the research activities of Agricultural Scientist in Ghana.
According to the Director, such an initiative would enable Ghanaian researchers to develop improved varieties of seeds for a full range of Africa's important staple like beans , cassava ,cowpea, maize, rice, sweet potato and sorghum."
cassava,Cassava - IITA Develops Cost Efficient Flash Dryer,https://allafrica.com/stories/200811280494.html,Nigeria: Cassava - IITA Develops Cost Efficient Flash Dryer,28 November 2008,Vanguard (Lagos),N/A,N/A,"The International Institute of Tropical Agriculture (IITA) has developed cost effective and efficient flash dryer that produces 300% more cassava flour while using 40% less fuel.
Cassava farmers and processors are set to earn bigger profits and get better-quality product from this new technology developed by scientists working at the International Institute of Tropical Agriculture and national partners in Nigeria."
cassava,Global Meltdown - Zambia Seeks Help,https://allafrica.com/stories/200811280409.html,Nigeria: Global Meltdown - Zambia Seeks Help,28 November 2008,This Day (Lagos),N/A,N/A,"Abuja — Zambian President, Rupiah Bwezani Banda, on his first foreign trip since he came into power in October, yesterday requested for Nigeria 's assistance to tackle effect of the global economic crisis on his country's economy.
This is as President Umaru Musa Yar'Adua said despite the stalemate in Zimbabwe's peace talk over power-sharing, the progress recorded deserves commendation."
cassava,Agric Equipment Producers Online,https://allafrica.com/stories/200811270880.html,Cameroon: Agric Equipment Producers Online,27 November 2008,Cameroon Tribune (Yaoundé),N/A,N/A,"A workshop to validate their data base took place last week in Douala.
Agric equipment producers in the country have decided to establish a common web site presenting their products. The website built by French expert, Eric Bernard was the object of a restitution and validation workshop that took place last 21-22 November in Douala."
cassava,Finding New Ways to Feed HIV-Positive People,https://allafrica.com/stories/200811270691.html,Burkina Faso: Finding New Ways to Feed HIV-Positive People,27 November 2008,PlusNews (Johannesburg),N/A,N/A,"Ouagadougou — High food prices and cuts in food aid to HIV-positive people are forcing relief organisations in Burkina Faso to take another look at local foods to keep people healthy.
""We are all working with sustainability in mind, and we cannot always continue to rely on external support,"" said Dr Joseph Aimé Bidiga, who runs the health division at the national AIDS control council, CNLS. ""We must take action to allow us to do as much as possible with our modest means."""
cassava,SON Okays Imoke's NGO Cassava Flour,https://allafrica.com/stories/200811270282.html,Nigeria: SON Okays Imoke's NGO Cassava Flour,27 November 2008,Vanguard (Lagos),N/A,N/A,"Standards Organization of Nigeria (SON) has presented a certificate to wife of Cross River State Governor, Mrs. Obioma Imoke for the Cassava flour being produced by her POWER project.
Mrs. Imoke's NGO, Partnership Opportunity for Women Empowerment Realization (POWER) which seeks to empower the women of Cross River State for economic growth, cater for the mother and child and promote education has been vigorously involved in ensuring that added value is given to the farm produce of the women in the state."
cassava;plantain;yam,Urhobo Task FG on Electricity,https://allafrica.com/stories/200811270280.html,Nigeria: Urhobo Task FG on Electricity,27 November 2008,Vanguard (Lagos),N/A,N/A,"National President of the Urhobo Development Association (UDA), Chief Thomas Essi says the Urhobo ethnic nationality in Delta State is entitled to free electricity supply to all its towns and villages because the people have sacrificed their lands and waters to oil companies and agencies for oil production, which in turn, has polluted their environment and impoverished them.
Chief Essi who stated this at the inauguration of the association, formerly Urhobo Monitoring and Development Group at Effurun, therefore, charged the Federal Government to ""supply our land genuine and new transformers together with other accessories and to give our people constant and affordable power supply."""
cassava;yam,IFAD Boost Agriculture with $200 Million,https://allafrica.com/stories/200811270278.html,Nigeria: IFAD Boost Agriculture with $200 Million,27 November 2008,Vanguard (Lagos),N/A,N/A,"The International Fund for Agriculture Development (IFAD) has earmarked the sum of $200 million to strengthen and step up agricultural sector in Nigeria.
Of this amount over $100 million has been disbursed for on-going projects on agriculture between the Federal Government and IFAD, while $50 million would be invested in improving and processing cassava in the country."
cassava,Why Government is Fighting Anaemia,https://allafrica.com/stories/200811270228.html,Rwanda: Why Government is Fighting Anaemia,27 November 2008,The New Times (Kigali),N/A,N/A,"Kigali — It will take many initiatives in order to achieve Vision 2020.
The surprising one and easiest is the support of a comprehensive food fortification programme."
cassava;yam,IFAD Invests N5.9 Billion to Improve Its Marketing,https://allafrica.com/stories/200811270703.html,Nigeria: IFAD Invests N5.9 Billion to Improve Its Marketing,26 November 2008,Daily Independent (Lagos),N/A,N/A,"Abuja — International Fund for Agriculture Development (IFAD) says it is investing $50 million (about N5.9 billion) to improve the market accessibility of cassava and its processing in the country.
The investment would also augment plans to diversify the huge focus on cassava and spotlight other crops that would better the lives and livelihood of small-scale rural farmers."
cassava,"IITA Develops New, Fuel Efficient Cassava Dryer",https://allafrica.com/stories/200811270582.html,"Nigeria: IITA Develops New, Fuel Efficient Cassava Dryer",26 November 2008,Daily Independent (Lagos),N/A,N/A,"Scientists working at the International Institute of Tropical Agriculture (IITA), Ibadan, and national partners in Nigeria, have developed a cassava flash dryer that produces 300 per cent more and better flour using 40 per cent less fuel.
A statement by IITA on Tuesday in Abuja said the improved flash dryer is capable of processing eight tonnes of raw cassava tubers into two tonnes of high-quality flour per day compared to the less than one tonne daily production of existing models."
banana;cassava;sorghum;sweet potato,Sweden to Fund More Research,https://allafrica.com/stories/200811270104.html,Uganda: Sweden to Fund More Research,26 November 2008,New Vision (Kampala),N/A,N/A,"Kampala — SWEDEN plans to fund more scientific research to boost food security and the management of natural resources in East Africa.
""We have supported five research projects and the Lake Victoria Research Initiative (VicRes). A new agreement will be signed soon,"" the ambassador, Anders Johnson, said."
cassava,Ebonyi Institutes Awards for Achievers as Varsity Gets New VC,https://allafrica.com/stories/200811260371.html,Nigeria: Ebonyi Institutes Awards for Achievers as Varsity Gets New VC,26 November 2008,Vanguard (Lagos),N/A,N/A,"ABAKALIKI-Ebonyi State government has instituted awards to honour categories of individuals and institutions that exhibit best virtues and values amongst their peers.
The awards includes: the cleanest local government area in the state, best local government chairman in the state, best development centre coordinator in the state, best local government area junior/senior staff, best GM/chairman of Board and best permanent secretary."
cassava,Agric Financing Key to Economic Growth - Agwu,https://allafrica.com/stories/200811260367.html,Nigeria: Agric Financing Key to Economic Growth - Agwu,25 November 2008,Daily Independent (Lagos),N/A,N/A,"Our agricultural banking started at the beginning of this year. The experience has been most beneficial. One thing we have found out is that microfinance banking goes to the root of the economy.
You should be able to recall that at the earlier part of this year there was a timid food crisis in the country to the extent that the presidency has to order for the importation of large quantity of food stuff like rice. This is not because we do not have enough farmers in the country."
cassava,Closing Country's National Poverty Gap,https://allafrica.com/stories/200811241337.html,Ghana: Closing Country's National Poverty Gap,24 November 2008,Public Agenda (Accra),N/A,N/A,"Tamale — Many of the women at the workshop of the Pagsung shea butter association are in their forties and fifties. Previously, each had collected and processed shea nuts as an individual, but earned so little she could barely get by, ""We found if we came together we could make more and sell more,"" explains Safiya Hassan, a recent university graduate who is helping the women.
The association now includes 13 groups of shea producers, all women, in Ghana's Northern Region. Together they are able to produce more than 20 tones of shea butter per month. Much of this, in the form of high quality shea soap and creams, is supplied to a Japanese company. As a group, the women are earning an additional profit of 10 Ghana cedis (US$11) for every 100 kilogrammes, compared to what they made as individual producers. That modest extra income has already changed the lives of many of the women."
cassava;sweet potato,Crop Institute to Incorporate Vitamin A in All Staple Foods,https://allafrica.com/stories/200811240743.html,Uganda: Crop Institute to Incorporate Vitamin A in All Staple Foods,23 November 2008,New Vision (Kampala),N/A,N/A,"Kampala — THE National Crop Resources Research Institute (NaCRRI)-Namulonge plans to embark on a project to incorporate vitamin A in all staple foods.
Dr. Robert Mwanga, a researcher at the institute, says the project aims at fighting Vitamin A deficiency in children and pregnant mothers."
banana;cassava;sorghum,Modified Crops Yield More,https://allafrica.com/stories/200811240264.html,Uganda: Modified Crops Yield More,22 November 2008,New Vision (Kampala),N/A,N/A,"Kampala — FOOD prices are rising. Climate change makes it harder to produce food than it was 20 years ago in many parts of Africa.
In Uganda, for example, the average size of a maize cob has become considerably smaller. Crops that did well in particular regions, like the banana, can no longer be grown successfully without expensive soil improvement and pest control techniques."
cassava,Restaurant Menu Go Regional,https://allafrica.com/stories/200811210276.html,Rwanda: Restaurant Menu Go Regional,21 November 2008,The New Times (Kigali),N/A,N/A,"Kigali — The end of the 1994 genocide saw political calm return to Rwanda. And many Rwandans journeyed from exile home. Fourteen years after they settled, there are still visible tendencies that depict their lifestyles when they were in exile.
Remera, located in the suburbs of Kigali City, is an area that harbours a considerable number of former exiles. The small restaurants in the area are faced with the task of identifying with the diverse customer preferences."
cassava;sweet potato,"Rains Subside, Easing Fears of Emergency",https://allafrica.com/stories/200811190649.html,Uganda: Officials Hope Emergency Will Be Avoided as Rains Subside,18 November 2008,UN Integrated Regional Information Networks,N/A,N/A,"Kampala — Heavy rains have displaced thousands and damaged crops in eastern and northern Uganda, but officials are optimistic an emergency will be avoided as better weather is predicted.
""Some people have been affected by heavy rains with some displaced, but this does not mean that we shall see an emergency because the meteorological department has already told us that the rains are at their end,"" Musa Ecweru, state minister for disaster preparedness and refugees, said."
cassava,Researchers to Increase Lifespan of Cassava Tubers,https://allafrica.com/stories/200811190062.html,Uganda: Researchers to Increase Lifespan of Cassava Tubers,18 November 2008,New Vision (Kampala),N/A,N/A,"Kampala — RESEARCH is on to prolong the life of cassava tubers after harvest.
Dr. Yona Baguma, a researcher at the National Crop Resources Research Institute, says they have identified genes from wild cassava that can be incorporated into the local type to delay its post-harvest deterioration."
cassava;sweet potato,'I Saw My Friend Beheaded' - LRA Abductee,https://allafrica.com/stories/200811171018.html,Uganda: Alice - 'I Saw My Friend Being Beheaded and His Body Cut Up',17 November 2008,UN Integrated Regional Information Networks,N/A,N/A,"Gulu — Children abducted by the Lord's Resistance Army (LRA) during its decades-long insurgency in the north have to live with the trauma and psychological scars long after their rescue and return to civilian life.
One such is Alice*, abducted in 2005 when she was only 12. She told IRIN about her escape from rebel captivity in northeastern Democratic Republic of Congo:"
cassava,Why We Are Tapping the Palm Tree Potentials - Anyanwu,https://allafrica.com/stories/200811170740.html,Nigeria: Why We Are Tapping the Palm Tree Potentials - Anyanwu,16 November 2008,Vanguard (Lagos),N/A,N/A,"Chief Longinus Anyanwu spoke on the agriculture policy of Imo State government and efforts being made to boost food production and contribute to the economy of the state.
Could you throw an insight into what the Imo State government has done so far to boost food production and alleviate poverty?"
cassava,Repayment of Loans our Greatest Challenge - Napep Boss,https://allafrica.com/stories/200811170738.html,Nigeria: Repayment of Loans our Greatest Challenge - Napep Boss,16 November 2008,Vanguard (Lagos),N/A,N/A,"Since the National Poverty Eradication Programme (NAPEP) was inaugurated in 2001 to address the challenge of poverty in Nigeria, it has been working in line with the United Nations Millennium Development Goals (MDG) desire to reduce the proportion of people living in poverty by the year 2015. NAPEP has, over the years, designed various schemes and projects to achieve its goals and objectives.
These include Youth Empowerment Scheme,Capacity Enhancement Scheme, Social Welfare Service Scheme and Rural Infrastructure Development Scheme among others. The coordinator of NAPEP in Lagos State, Chief Yakub Abiola Aromashodu recently spoke on the misconceptions people have about NAPEP's activities."
cassava;sweet potato,"Floods Cut Off Katakwi, Amuria Roads Again",https://allafrica.com/stories/200811170542.html,"Uganda: Floods Cut Off Katakwi, Amuria Roads Again",16 November 2008,New Vision (Kampala),N/A,N/A,"Kampala — FLOODS have again cut off the Katakwi-Amuria road after Ajelek Bridge that connects the two districts collapsed.
A total of 6,222 households in Katakwi district have been affected."
cassava;yam,"Second Niger Bridge Still Undone? I Approved Budget for It 14 Years Ago!,",https://allafrica.com/stories/200811170148.html,"Nigeria: Second Niger Bridge Still Undone? I Approved Budget for It 14 Years Ago!,",16 November 2008,Vanguard (Lagos),N/A,N/A,"Two-time Finance Minister, Dr Kalu Idika Kalu, who, at different times, also served as minister of national planning and minister of transport, penultimate week in Abuja, spoke to Sunday Vanguard on the global economic meltdown and sundry economic issues on the domestic front.
The BGL chairman and member, Presidential Technical Committee on Niger-Delta, also spoke on the Niger Bridge even as he gave insight into what Nigerians should expect from his committee."
cassava;sorghum;sweet potato,Input Trade Fairs Falling Short,https://allafrica.com/stories/200811150158.html,Eswatini: Input Trade Fairs Falling Short,15 November 2008,Inter Press Service,N/A,N/A,"Mbabane — Mary Ntshangase sits under a big umbrella -- a packet of beans in one hand and a packet of peanuts in the other -- wooing customers to her stall.
She is one of the vendors displaying their wares at the input trade fair at Matsanjeni, in the drought-stricken Lubombo region of eastern Swaziland."
cassava;sweet potato,"Volta Basin Problems, Whose Headache? (1)",https://allafrica.com/stories/200811140951.html,"Ghana: Volta Basin Problems, Whose Headache? (1)",14 November 2008,Public Agenda (Accra),N/A,N/A,"Each group of people has a traditional vocation which distinguishes them from others. If you are a costal dweller you may be a fisherman or a hunter if your geographical location is by a forest. This explains reasons for which people resist attempts by governments to relocate them from their ancestral locations no matter how well the intentions. The case of the Kabakas of Uganda needs no elaboration.
If you were a bit old and ever traveled across the Sogakope Bridge in 1970s you would have noticed the commonness of oysters, known as 'adordi' or 'aforli', sold in various forms. Indeed, it was a huge business among the people, particularly the women folks."
cassava,"Over 1.5 Million in Benefit From Return of Cassava, UN Reports",https://allafrica.com/stories/200811140006.html,"Africa: Over 1.5 Million in Benefit From Return of Cassava, UN Reports",13 November 2008,UN News Service,N/A,N/A,"Following years of massive crop losses caused by a devastating virus, the tropical root crop cassava - one of Africa's principal foodstuffs - has made a comeback and is benefiting some 1.65 million people throughout the Great Lakes region, the United Nations Food and Agriculture Organization (FAO) reported today.
""Having cassava back on the table is of major importance, especially to the region's most vulnerable, who have been hit hard by this year's global food crisis,"" said Eric Kueneman, Chief of the FAO Crop and Grassland Service."
cassava,"Disease Devastates Cassava Crop, Threatens Widespread Hunger",https://allafrica.com/stories/200811130803.html,"Congo-Brazzaville: Disease Devastates Cassava Crop, Threatens Widespread Hunger",13 November 2008,UN Integrated Regional Information Networks,N/A,N/A,"Brazzaville — Cassava is the staple food for most people in the Republic of Congo, but this main source of nourishment is being threatened by a disease that has spread to most areas of the country.
""We've been having problems for more than two years and it's getting worse with the mosaic destroying our crops,"" said Rose Ambeto, who has several cassava fields."
cassava,"Floods Strike Again, Kill Two",https://allafrica.com/stories/200811130386.html,"Uganda: Floods Strike Again, Kill Two",12 November 2008,New Vision (Kampala),N/A,N/A,"Kampala — Floods that ravaged the north and northeastern region last year are back, killing two UPDF soldiers in Nakapiripirit and Bukwo districts.
Three districts of Kotido, Abim and Kaabong are now inaccessible from Moroto."
cassava,Corridors of Power,https://allafrica.com/stories/200811130356.html,Uganda: Corridors of Power,12 November 2008,New Vision (Kampala),N/A,N/A,"Kampala — Animal farm
Local government minister Kahinda Otafiire on Tuesday amused Parliament when he said Kampala City Council (KCC) had turned the city into an 'animal farm'. ""Tourists are welcomed by flower gardens fenced with barbed wire instead of green gardens. The impression one gets in a city is an enclosure of animals. ""In Europe and other cities green natural vegetation is treasured. In the United Arab Emirates green is treasure number one, while in Uganda the natural beauty scenery is replaced by barbed wire. Otafiire was requesting parliament to approve $ 33.6m to revamp the city."
cassava,Dutch Youth Get the Feel of Ugandan Life,https://allafrica.com/stories/200811130283.html,Uganda: Dutch Youth Get the Feel of Ugandan Life,12 November 2008,New Vision (Kampala),N/A,N/A,"Kampala — UGANDA is a beautiful country, says Jolanda Vian Schie, a citizen of the Netherlands. And to show how much she appreciates the country Jolanda who has been in and out of Uganda for the last six years married a Ugandan.
So strong is Jolanda's attraction that she brought youth from Netherlands to see Uganda's beauty. Through the Netherlands Young Men's Christian Association (YMCA), Jolanda initiated a partnership with YMCA Uganda. The associations started a Ugandan-Dutch exchange programme for young people to visit and learn about each other's way of life."
cassava;sorghum;sweet potato,Floods Halt Moyo Road Works,https://allafrica.com/stories/200811120701.html,Uganda: Floods Halt Moyo Road Works,11 November 2008,New Vision (Kampala),N/A,N/A,"Kampala — FLOODS have stopped the construction of the Moyo-Obongi road.
The 77-kilometre project, that is to cost sh500m, stalled in September when the River Nile burst its banks due to heavy rains and displaced people in Itula and Gimara sub-counties in Obongi."
cassava,Locals Sue Shell in Dutch Court Over Oil Spills,https://allafrica.com/stories/200811110316.html,Nigeria: Locals Sue Shell in Dutch Court Over Oil Spills,11 November 2008,Vanguard (Lagos),N/A,N/A,"AN environmentalist group and four Nigerians filed suit against Royal Dutch Shell PLC in The Netherlands on Friday, claiming the company was negligent in cleaning up oil spills in Nigeria.
The civil suit filed by the four men and Friends of the Earth is unusual in that it seeks to hold Shell's parent company liable for damages allegedly caused by its Nigerian subsidiary."
cassava,Engineer Wants Citizens to Emphasise Agriculture,https://allafrica.com/stories/200811180846.html,Nigeria: Engineer Wants Citizens to Emphasise Agriculture,10 November 2008,Leadership (Abuja),N/A,N/A,"Mr Anthony Shobo, the country's first chemical engineer, has called on Nigerians to be more involved in agriculture to ensure greater economic balance.
Shobo, who graduated as a chemical engineer in 1957, told the News Agency of Nigeria (NAN), at Effurun in Delta State, that the country should shift emphasis from crude oil since agriculture was more profitable."
cassava,"Country Needs a Blend of Sources of Power, Says Bakare, MD, Nigerian Wire and Cable",https://allafrica.com/stories/200811100662.html,"Nigeria: Country Needs a Blend of Sources of Power, Says Bakare, MD, Nigerian Wire and Cable",9 November 2008,Vanguard (Lagos),N/A,N/A,"Meeting him for the first time, you might mistake him for an undergraduate, because he does not look his age.
Born in Ilesha in Osun State, Lateef Akande Bakare, a chartered accountant, is 53 years old. He is a director in many blue chips companies in the country which cut across the various sectors of the economy, but currently managing director/CEO of the Nigerian Wire & Cable, which he was appointed to turn around last year."
cassava,Export Path Trains Nigerians for Agoa Benefits,https://allafrica.com/stories/200811070242.html,Nigeria: Export Path Trains Nigerians for Agoa Benefits,7 November 2008,Vanguard (Lagos),N/A,N/A,"Export Path, a consortiums of several organisations Vertical Optimisation, Nigerian Export Promotion Council (NEPC), the Nigerian Embassy in Washington DC, US Department of Commerce, NEXIM Bank, and Diamond Bank, has began the process of training Nigerian exporters to enable them access to the United States market and reap some benefits under the African Growth Opportunity Act (AGOA).
The agency provides exporters with three things, viz: It helps them develop products that can sell in the US. ""We provide them financing to manufacture the product and help them sell it. That is what Export Path does,"" according to Emeka Nwankwo, who is coordinating the training."
cassava;sweet potato,Govt Prepares to Approve Biosafety Legislation,https://allafrica.com/stories/200811070020.html,Kenya: Govt Prepares to Approve Biosafety Legislation,6 November 2008,SciDev.Net,N/A,N/A,"Nairobi — The Kenyan government plans to pass its proposed biosafety bill next month (December) following years of delays.
Mary Kamau, a director from the research and technical training division of the Kenyan Ministry of Agriculture, said the Biosafety Bill 2008 should be passed before the Kenyan parliament breaks up for Christmas. After that it will go to President Mwai Kibaki for approval or rejection."
cassava,"We Could Go the Amin, Obote Way",https://allafrica.com/stories/200811101154.html,"Uganda: We Could Go the Amin, Obote Way",5 November 2008,The Observer (Kampala),N/A,N/A,"For three whole days, Radio Uganda blared the startling news by Idi Amin's military spokesman, normally a euphemism for the Big Daddy himself, that a fleet of American, Chinese, Indian and Israeli planes had been sighted over the Indian Ocean near Mombasa, heading to attack Uganda.
It became the slowest flight of military planes in history because to date none of the alleged planes has arrived anywhere in Uganda to discharge their deadly payload. This was one of the favourite antics that delighted Amin to dramatize himself at a time when his blood drenched regime was besieged with innumerable difficulties just before it collapsed from its misadventure with Tanzania."
